rank,handle,name,followers,tier,posts_sampled,avg_views,avg_likes,lanes,score,sample
1,LinghuaJ,"Linghua Jin 🥥 🌴",6422,rising,2,81760,267,"ai-teaching",124.1,"big fan of @cerebras - definitely ++ 🔥 'level of smarts here applied to company operations makes me"
2,cailen,"Cailen D'Sa",2527,rising,2,39741,325,"coding-ai|startups-gtm",120.2,"From our vantage point at Crew, these are the AI-native GTM Mafia’s forming right now:  •Profound •H"
3,rezoundous,"Tyler",6681,rising,2,15543,438,"coding-ai",115.2,"GPT-5.6 is better on Codex than Cursor because it comes with Tibo resets"
4,katiekirsch,"Katie Kirsch",10356,mid,3,17825,171,"pm-product",113.6,".@Plaid is hiring 100+ roles right now! A few that stand out, all for $230K+...  - Head of Investor "
5,LuminaXspace,"Lumina",2883,rising,2,21054,207,"models-news",104.2,"🚨 A fresh Claude Opus 5 release-window leak just surfaced  The latest claim points to a possible Ju"
6,N01ennn,"NO1ennn",3103,rising,3,5828,83,"agents-evals|ai-teaching|models-news",103.5,"THE FIRST SERVER RUNNING NVIDIA'S VERA CPU JUST GOT CRACKED OPEN, AND THE CPU IS NOT THERE TO COMPUT"
7,milindlabs,"Milind S",1376,rising,2,15367,179,"coding-ai|models-news",98.2,"I turned tldraw into paper that answers back.  You can type and it will respond back to you  You can"
8,ihtesham2005,"Ihtesham Ali",45989,mid,1,51989,2450,"agents-evals",95.9,"A guy named Shin just open-sourced Palantir for free.  It is called OpenPlanter.  Palantir helps gov"
9,NickADobos,"Nick Dobos",53381,mid,2,56976,718,"coding-ai",95.6,"Claude code added EndConversation tool  Pretty cool that my professional tool can decline to do the "
10,kunchenguid,"Kun Chen",16645,mid,1,162071,804,"models-news",90.8,"ok just spent a morning with Kimi K3 as my firstmate, here's my real experience  1. it's very, very "
11,aporia9n,"Aporia",2556,rising,1,162347,1843,"startups-gtm",88.5,"In fact half the people I meet in beach clubs in St Tropez / Marbella are doing exactly this: one ye"
12,Lentils80,"Lentils",4430,rising,1,133209,1653,"models-news",85.8,"🚨 Update:  U1 Pro, the Chinese image model I talked about last month which can output 8K images and"
13,abdulsalamhissa,"Luzhid.uiux",1074,rising,1,54341,2517,"pm-product",83.7,"Tomorrow would be my first day as a Product management intern at Moniepoint 😊"
14,AIsaOneHQ,"Alsa",1525,rising,1,742644,195,"models-news",70.0,"🌑 Kimi K3 @Kimi_Moonshot just outbuilt GPT-5.6 Sol in our 3D modeling benchmark.  We asked both mod"
15,jacalulu,"Jaclyn Konzelmann",10002,mid,1,45447,318,"pm-product",70.0,"I’m hiring again at @GoogleLabs! After the amazing response to the last opening, I'm excited to shar"
16,undefinedKi,"Yarchi",11341,mid,3,9028,102,"coding-ai|models-news",68.1,"Anthropic just gave away 11 plugins that turn one Claude into an entire company's worth of specialis"
17,0x0SojalSec,"Md Ismail Šojal 🕷️",47647,mid,2,61104,363,"startups-gtm",64.8,"Fuc*k your paid courses, @Kimi_Moonshot AI founder (Yang Zhilin) explained how they're running 300+ "
18,ParamSiddh,"Param",6429,rising,1,27481,623,"ai-teaching",64.5,"As an AI Engineer. Please learn  >Harness engineering, not just prompt engineering  >Context enginee"
19,rammcodes,"Ram Maheshwari",1749,rising,1,32691,472,"coding-ai",62.8,"Bruh... someone recreated the UI of Claude Code, Codex & Grok as reusable ShadCN components. 🤯  Thi"
20,ImMeme0,"I Meme Therefore I Am 🇺🇸",879851,mega,1,477329,25962,"pm-product",59.4,"Google Product Manager on a hike in a national park spots white people peacefully enjoying nature… a"
21,sgnoogle,"Francesco Sgnaolin",5007,rising,2,8999,95,"coding-ai|models-news",58.8,"blockit 2.0 is rolling out • the biggest update ever  I rebuilt the app in 15 days with Claude Code "
22,ClaudeDevs,"ClaudeDevs",609539,mega,1,1829225,16369,"coding-ai",58.4,"We're also keeping Claude Code weekly limits 50% higher, now through August 19, for all Pro, Max, Te"
23,jhleath,"Hunter Leath",4278,rising,1,45631,253,"pm-product",58.3,"my first job (on Amazon EFS's storage layer) was what you might call 'TIGER STYLE' in a hybrid of AN"
24,BenokNFT,"Chan.",9409,rising,2,2977,159,"coding-ai|models-news",53.5,"the hardest part of building in web3 has never been the idea.  it's everything that comes before lau"
25,jamiecuffe,"Jamie Cuffe",3409,rising,2,5682,67,"agents-evals|startups-gtm",53.0,"We're growing the research team at Pace. The project I'm most excited about right now is a new produ"
26,JayBisen473370,"Jay Bisen",26456,mid,1,46753,480,"ai-teaching",52.9,"🚨 Harvard just made its AI course free.  No tuition. No application. Just world-class AI education."
27,cramforce,"Malte Ubl",49412,mid,1,224930,644,"models-news",52.0,"We ran Kimi K3 on a private cybersecurity benchmark.   TL;DR: Kimi K3 is the workhorse for cyber sec"
28,0xSlyth,"0xSlyth",3550,rising,2,2282,74,"agents-evals|coding-ai",50.5,"A 21 YEAR OLD DIDN'T GET BETTER AT PROMPTING AFTER GPT-5.6 DROPPED  HE GOT BETTER AT BUILDING  every"
29,Hazbiyallahu_,"Faruq OLÒKOBA",3831,rising,1,24930,145,"pm-product",49.5,"A female friend of mine, whom I’ve known for a while, called me this morning unexpectedly to share h"
30,Nekt_0,"Nekt0",3223,rising,2,4885,60,"coding-ai",48.6,"7 CLAUDE SKILLS TURN ONE LAPTOP INTO A CREATIVE STUDIO THAT CAN RESEARCH, WRITE, NARRATE, EDIT AND R"
31,SpikeCalls,"Spike 1%",3648,rising,1,20434,142,"coding-ai",48.3,"Claude Code turned 4,700 Obsidian notes into a working neural network in one evening.  Not a metapho"
32,ProMint_X,"ProMint",5094,rising,1,53527,135,"startups-gtm",47.9,"Are you ready to be drained today?  @seyong, Co-Founder of @fomo, stated that all of Fomo's code was"
33,venusianpisces,"✩ open!",4843,rising,1,6696,224,"models-news",46.8,"what celebrations coming in 📸  aries: there’s a celebration connected to an achievement you almost "
34,Asteri_eth,"Asteri",2217,rising,1,4050,259,"models-news",45.3,"STOP USING CLAUDE AS A WORKER. HIRE IT AS A MANAGER  Most developers are stuck in the Level 1 trap o"
35,bunnypawanist,"వీరేంద్ర",2839,rising,1,14502,118,"ai-teaching",44.9,"🚨 Hiring: Junior AI Engineer  📍 Location: Madhapur, Hyderabad (Onsite) 💼 Experience: 0.5–2 Years "
36,ankrgyl,"Ankur Goyal",11937,mid,1,15526,235,"agents-evals",44.3,"there are three stages of evals:  1. vibe check in a loop / make it feel good 2. handwrite 10-20 sce"
37,dkundel,"dominik kundel",22356,mid,1,29002,349,"models-news",43.6,"Beginning with the launch last week, GPT-5.6 Sol will be included in all Plus, Pro, Business, and En"
38,simplifyinAI,"Simplifying AI",36400,mid,1,28728,509,"models-news",43.4,"ANTHROPIC AND OPENAI BOTH MISSED THIS.  Someone just open-sourced one SDK that gives AI agents a mou"
39,deredleritt3r,"prinz",16272,mid,1,29438,270,"models-news",43.4,"Added to prinzbench: Kimi K3.  K3 is by far the best open-source model I have tested to date.  Its o"
40,kuddus0356575,"SARKER",21528,mid,2,5080,162,"agents-evals|startups-gtm",43.1,"𝐖𝐨𝐫𝐤 𝐒𝐦𝐚𝐫𝐭𝐞𝐫 𝐄𝐱𝐞𝐜𝐮𝐭𝐞 𝐅𝐚𝐬𝐭𝐞𝐫           𝐖𝐞𝐥𝐜𝐨𝐦𝐞 𝐭𝐨 𝐎𝐩𝐞𝐧𝐘𝐚𝐛𝐛𝐲"
41,nejatian,"Kaz Nejatian",78544,mid,1,108385,766,"pm-product",43.0,"I think of myself as a product manager. I've hired and trained more product managers than most.  I a"
42,bonsaixbt,"Bonsai 🌳",2219,rising,1,10917,100,"models-news",42.1,"CLAUDE + OBSIDIAN = A SELF-IMPROVING SECOND BRAIN WITH UNLIMITED MEMORY  If you’re using Claude Code"
43,tomhacks,"Tom Siwik",47447,mid,1,26935,589,"models-news",41.3,"I've canceled my Anthropic subscription.  Tried to replicate a research algorithm with nuanced modif"
44,Mr_Salio,"Salio",1518,rising,1,9403,96,"models-news",41.0,"🚨 Gemini 3.5 Pro Is Taking Longer Than Anyone Expected  Google has confirmed it's still testing Gem"
45,FinPhilosopher,"Finance Philosopher 🖌",19716,mid,1,17030,305,"pm-product",40.2,"Guy at my company was promoted a few months ago to take over the product management team. He got no "
46,mehrab_build,"Mehrab | SEO Mode",3770,rising,1,6800,106,"models-news",38.5,"5 SEO fixes you can delegate to Claude in an afternoon:  - Pull your top 10 pages from GSC - Add 3 c"
47,SokeyeA,"Afolabi Sokeye 🧱",11068,mid,1,11954,192,"pm-product",38.2,"Since this is a renewed TL let me re-introduce myself to my mutuals and audience 🚀  Hi my name is A"
48,promptparag,"Parag pawar",1685,rising,1,3180,123,"ai-teaching",38.1,"Stop wasting hours trying to learn AI.  I have already done it for you.  With one list. Zero confusi"
49,ramesh_vd,"TruthCapital",2696,rising,1,6323,82,"startups-gtm",37.9,"#SacheeromeLtd #Sacheerome  A company that never sells you anything directly — no brand, no shelf sp"
50,LunarResearcher,"Lunar",27611,mid,2,12869,127,"coding-ai|ai-teaching",37.9,"Anthropic's Claude Code creator revealed what developers should learn next.  Not another coding tuto"
51,RoundtableSpace,"0xMarioNawfal",257257,large,6,48706,89,"agents-evals|coding-ai|ai-teaching|models-news",37.9,"THIS OPEN-SOURCE TOOL BRINGS PALANTIR-STYLE DATA ANALYSIS TO EVERYONE  * Connects public records int"
52,natan_mohart,"Natan Mohart",1000,rising,1,4244,97,"ai-teaching",37.6,"Everyone talks about prompt engineering.  Almost nobody talks about thought engineering.  The bigges"
53,Restructuring__,"Restructuring__",50895,mid,1,68603,469,"pm-product",37.2,"First week of M7 MBA is paradise   You wake up at 7:42am, eighteen minutes before your alarm. Your b"
54,dexhorthy,"dex",22984,mid,1,19647,303,"coding-ai",37.1,"today's fun ai coding tricking - when doing the high-level part of your plan, do an amazon-style 'wo"
55,iamveektoria_,"Iamveektoria.base.eth 🙂‍↔️🌳 ✠",29883,mid,1,21614,355,"pm-product",36.3,"This drive is a goldmine for:  https://t.co/KhAXIPJRoP  → Interview tips and tricks → Data Analytics"
56,meenakshei,"Meenakshi",2360,rising,1,2688,106,"pm-product",36.2,"My product manager is the cutest. Whenever we meet, he gives me a handful of chocolates and says tha"
57,RunAnywhereAI,"RunAnywhere (YC W26)",1411,rising,1,7179,60,"agents-evals",35.8,"A 27B parameter model used to need a server room.  Now it runs on: • iPhone • Android • Mac  @PrismM"
58,OopsGuess,"𝘊𝘰𝘳𝘳𝘪𝘯𝘦",55574,mid,1,35009,518,"models-news",35.8,"This is the funniest part.  5 months ago, Dario Amodei said Anthropic had “almost never” lost a deal"
59,Fortwin___,"Semi permanent seed of discord🌪️🕷️💜",9507,rising,1,6120,202,"pm-product",35.5,"2 years work-iversary as a Product Manager now🫶🏾"
60,kumar58429,"Knox.eth🍌",13728,mid,1,1415,277,"models-news",34.9,"The biggest challenge in blockchain has never been a lack of ideas.  It is been the cost of turning "
61,Grokcardano,"GrokCardano",3282,rising,1,1678,117,"agents-evals",34.7,"Cardano is entering a new era! 🔥 Hoskinson just took a bold step — handing over core development to"
62,PodcastAlphaX,"Podcast Alpha",13599,mid,1,70333,157,"startups-gtm",34.4,"PayPal peaked near $322B. It trades around $30-40B now.  David Sacks @DavidSacks walked the fall: a "
63,neil_xbt,"NeilXbt",16410,mid,2,6246,89,"ai-teaching",34.2,"Ryan Lopopolo of the OpenAI Codex team: 'Agents are not hard; the harness is hard.'  Here's what act"
64,blckshnbrt,"Crypto 💰 🤑 MELANIN Ⓜ️🆆",6829,rising,1,583,230,"startups-gtm",34.0,"2:17 AM.  The office is empty.  The founder went home hours ago.  His laptop didn't.  One AI is rese"
65,Aura_lixx,"Auralix",1741,rising,1,1377,120,"ai-teaching",34.0,"99% of people use AI wrong. This Prompt Engineering Cheat Sheet changes everything. 🧠 https://t.co/"
66,chadwahl,"Chad Wahlquist",20908,mid,1,13254,263,"pm-product",33.8,"FDE’ing is a product strategy. Believe it or not, this is where most of Palantir is built, at the ed"
67,monokern,"monokern",3221,rising,1,7543,79,"coding-ai",33.1,"SOMEONE JUST OPEN-SOURCED A FREE ALTERNATIVE TO CLAUDE DESIGN WITH NO LIMITS  u can now build UI pro"
68,AC__research,"Arborator Capital Research",1187,rising,1,4732,52,"startups-gtm",33.0,"One of our highest-conviction ideas is going live today🔥  44% revenue growth until 2028 4x 2028 ear"
69,Axel_bitblaze69,"Axel Bitblaze 🪓",128228,large,3,16933,180,"agents-evals|coding-ai",32.7,"Wow! Someone open sourced 100+ full AI apps you can just clone and ship..    and it's sitting at 124"
70,bendee983,"Ben Dickson",5587,rising,1,7153,115,"agents-evals",31.6,"I think this misses the point of vibe coding.  To me, vibe coding was never about generating product"
71,Tanaypawar27,"Tanay Harinkhede",3355,rising,1,1936,92,"ai-teaching",31.5,"Stop wasting hours trying to learn AI.  I have already done it for you.  With one list. Zero confusi"
72,FLX_INTL,"FELIX INTERNATIONAL ♍︎",19938,mid,1,3327,279,"pm-product",31.0,"📰 ONews TV highlights brand ambassador #FELIX in their latest coverage detailing Gong Cha Korea's i"
73,Daevee007,"Ebuka Chidube👑",2756,rising,1,2999,73,"startups-gtm",30.8,"If you work in tech and you run ads, you need to read this.  Your ads are bringing in users but your"
74,StormDirac,"Anders Storm",13640,mid,1,11418,171,"pm-product",30.7,"'Is Optical Scale-Up Finally Approaching? NVLink Fusion hints that optics may be moving inside the r"
75,ArtificialAnlys,"Artificial Analysis",117362,large,1,108196,1154,"models-news",30.6,"The frontier has opened up: four frontier launches in eight days - Grok 4.5, GPT-5.6, Muse Spark 1.1"
76,tom_doerr,"Tom Dörr",213660,large,4,7138,80,"agents-evals|coding-ai",30.5,"Generates full-stack AI agents with FastAPI and Next.js featuring RAG, streaming, and authentication"
77,Rifat_EE,"Rifat Ahmed",34293,mid,1,19958,305,"startups-gtm",30.3,"A kid built a nuclear reactor,,  @sequoia just wrote him a billion dollar check for it,,,  The compa"
78,effiekav,"Effie Kavoura 🔶",6518,rising,1,3384,133,"agents-evals",29.7,"Everyone talks about AI getting smarter. Not enough people talk about AI becoming economic.  That’s "
79,Av1dlive,"Avid",19207,mid,1,31522,171,"ai-teaching",28.5,"holy sh*t this is insane  Someone open-sourced a Prompt Engineering guide for GPT 5.6 and Fable 5  A"
80,ClaudeCodeLog,"Claude Code Changelog",75667,mid,2,13942,102,"coding-ai",28.4,"Claude Code 2.1.215 has been released.  1 CLI change  Highlights: • Documentation designates ripgrep"
81,snskritinaruka,"Sanskriti Naruka",12975,mid,1,13160,143,"ai-teaching",28.0,"Your AI can write the presentation.  Dokie AI makes it look like your company actually designed it. "
82,Zun2025,"Zun",42034,mid,1,22085,306,"models-news",28.0,"been using claude for the last 6 months, they keep upgrading their model, high benchmark score yet w"
83,akhilesh9235,"Akhilesh Yadav",1443,rising,1,988,59,"ai-teaching",27.7,"AI is not the future anymore. It’s the skill gap of today. 🤖  The problem?  Most people want to lea"
84,Jaxxx_eth,"Jaxx",22827,mid,1,5322,239,"models-news",27.2,"The biggest bottleneck in blockchain development has never been ideas.  It's infrastructure.  For ye"
85,mikenevermiss,"MIKE",15342,mid,1,26369,139,"models-news",27.1,"Fable 5 access just got extended again.  update Claude Code to 2.1.170  connect it to a structured A"
86,BitcoinJesusETH,"John Gillen - WartimeEthereum.eth",4535,rising,1,9373,79,"agents-evals",26.9,"'The reason I care so much about Ethereum is because I do believe if AI agents are coming, if tokeni"
87,0xwhrrari,"rari",8998,rising,1,11554,127,"ai-teaching",26.8,"Andrew Ng just dropped the best 2-hour prompt engineering course of 2026  From brainstorming and age"
88,rohanpaul_ai,"Rohan Paul",152906,large,3,11406,111,"startups-gtm|models-news",26.8,"This is Moonshot AI/Kimi K3's founder & CEO Yang Zhilin at GTC 2026   The 34-year-old researcher stu"
89,h100envy,"h100envy",3424,rising,1,6172,67,"agents-evals",26.7,"The creator of Pydantic explained how to make live agents smarter after they ship in 1 hour 21 minut"
90,ZaraIrahh,"Zara",14457,mid,1,9906,149,"models-news",26.5,"AI video tools solved generation. Nobody solved the workflow around it.  Watching TapNow's Creative "
91,EXM7777,"Machina",127127,large,2,33065,262,"coding-ai",26.4,"this is the setup the top 1% of operators are running right now:  instead of relying on just Claude "
92,0xMovez,"Movez",32276,mid,1,24671,223,"agents-evals",26.2,"Andrew Ng:  “100% of my tasks are now handled by AI agents - hype has exceeded my expectations.  In "
93,ZhihuFrontier,"Zhihu Frontier",10570,mid,1,30764,99,"models-news",26.1,"🌊 Kimi K3 Is a 2.8T Open Model Built to Compete Across the Board Zhihu contributor toyama nao publi"
94,jackcoder0,"Jack",40254,mid,2,6805,77,"pm-product",25.9,"90% of Claude users type a question, read the answer, and close the tab.  That's a free AI tool with"
95,NainsiDwiv50980,"Nainsi Dwivedi",21508,mid,1,13747,180,"ai-teaching",25.7,"The biggest AI skill of 2026 isn't prompt engineering.  It's realizing that you should no longer be "
96,harleyfoote_,"Harley Lewis Foote",6841,rising,1,131184,73,"agents-evals",25.7,"I’m putting together the founding cohort for Hermes Shield.  Around 20 people who want to help us bu"
97,tawnniee,"tawny",10932,mid,1,5842,126,"ai-teaching",25.6,"how did we go from engineers work on trains  to engineers are licensed and educated  to computer 'sc"
98,dair_ai,"DAIR.AI",128269,large,3,8338,101,"agents-evals|coding-ai",25.5,"// Bad Memory in Agents //  (bookmark it)  Persistent memory is what makes an agent feel useful acro"
99,0xWasa,"WASA",3897,rising,1,3466,75,"startups-gtm",25.3,"I hesitated for a long time before writing this, but here is my story.  I really got into crypto in "
100,testingcatalog,"🚨 AI News | TestingCatalog",70728,mid,1,33139,330,"coding-ai",25.1,"ANTHROPIC 🔥: Claude Code weekly limits will be 50% higher through August 19, for all Pro, Max, Team"
101,TruthNetwork24,"Cheryl Anne",15728,mid,2,846,75,"pm-product",24.4,"Good Morning @CVSHealth @cvspharmacy @CVSCareers @CVSHealthJobs  How does it feel to rob Americans i"
102,m_goes_distance,"Mgoes (bio/acc 🤖💉)",37622,mid,2,3080,81,"startups-gtm|models-news",24.3,"one of the best use cases of AI is accelerating biology  this year alone we've seen:  - an independe"
103,gailcweiner,"Gail Weiner",3846,rising,1,2325,75,"pm-product",24.3,"Last year OpenAI rolled out its guardrails project with a single sentence from a product manager. So"
104,RepealTCPA1947,"Workhouse Overseer 🌐🥑🍌",3111,rising,1,2251,63,"pm-product",23.8,"Fake jobs like HR lady, product manager, post-liberal grievance monger, vice president of the United"
105,SahilPanhotra,"Sahil Panhotra | Indie Builder | Dev",2132,rising,1,2840,46,"startups-gtm",23.7,"Meet Pieter Levels  → Grew up in the Netherlands  → Studied Business Administration  → Tried the tra"
106,Mho_23,"Miko",28630,mid,1,15656,183,"coding-ai",23.4,"Claude Code + Gemini Omni + GPT Image 2 is f*cking cracked  i just built an AUTOMATED AI UGC content"
107,carte_free,"adel.eth",5908,rising,1,1079,111,"models-news",23.3,"Does every Web3 idea really need to be built on the same blockchain?  That’s the question @CNPYNetwo"
108,TrendGemini,"Trend Gemini ♥️",9489,rising,1,2632,135,"models-news",23.0,"❥ 𝐻𝑎𝑠ℎ𝑡𝑎𝑔 𝑆𝑢𝑚𝑚𝑎𝑟𝑦 𝐹𝑜𝑟 𝐺𝑒𝑚𝑖𝑛𝑖 ♡                • 15.07.2026 •   [ Update : 1.15"
109,SemiAnalysis_,"SemiAnalysis",139900,large,1,94768,799,"models-news",22.7,"A year ago, the big three was OpenAI, Anthropic, and Google. Things have changed.  Moonshot's Kimi K"
110,EarnByAbhi,"Abhi.eth",27553,mid,1,12809,176,"models-news",22.7,"Update on @arc :  As more people are getting the Architect and Builder roles, here's what you should"
111,baltmatrix,"baltmatrix",9664,rising,1,91737,81,"ai-teaching",22.7,"I'm STRONGLY encouraged to us AI at work.  So here's an AI generated image of Unicron eating a hot d"
112,championswimmer,"Arnav Gupta",81082,mid,1,33265,290,"pm-product",22.7,"Regardless of whatever anyone says about Anthropic safety drama, product strategy etc, one thing tha"
113,Brown_Thunder76,"Brown Thunder",2817,rising,1,2285,55,"coding-ai",22.5,"So I got bored..  A few days ago I came across a site called https://t.co/ceDZ0uetQN. One of the dev"
114,Ai_Vaidehi,"Vaidehi",15439,mid,1,6672,131,"ai-teaching",22.5,"Stop wasting hours trying to learn AI.  One list. Zero confusion. No fluff.  I’ve already done the h"
115,DAIEvolutionHub,"Kshitij Mishra | AI & Tech",49973,mid,2,4542,64,"agents-evals|coding-ai",22.4,"10 GitHub repositories worth checking out this week. 🔥  These are some of the fastest-growing and m"
116,gippp69,"Gipp 🦅",7944,rising,1,5812,101,"models-news",22.3,"F**KING 8,300-STAR REPO TURNS CLAUDE CODE INTO A PARALLEL SOFTWARE TEAM THAT PLANS, BUILDS, TRACKS, "
117,Logical_Girll,"Theinfralab",47084,mid,1,71124,173,"ai-teaching",22.3,"Everyone's talking about AI video models.  I think the real opportunity is making AI useful for mark"
118,iam_chonchol,"Alamin",104140,large,1,73636,633,"ai-teaching",21.9,"All Paid Courses (Free for First 4500 People)   𝗣𝗮𝗶𝗱 𝗖𝗼𝘂𝗿𝘀𝗲 𝗙𝗥𝗘𝗘 (PART - 2)  1. Artifi"
119,stylishdawg,"ein",2849,rising,1,4233,49,"pm-product",21.8,"this is not about my job btw. every product manager i’ve worked with has been amazing. it’s more abo"
120,nonieengel,"Leonie Engel",5572,rising,1,6565,74,"pm-product",21.7,"we're hiring for two pretty fun and hugely impactful roles at @odysseyml:   - Technical Product Mana"
121,PiousGeek,"Kay 🪔",25234,mid,1,5641,176,"pm-product",21.5,"Hey Tweeps 👋  Kolapo Imam here; I’m a Product Manager, founder @Prodcademy and Product Mentor livin"
122,noisyb0y1,"Noisy",22731,mid,2,2703,50,"agents-evals|coding-ai",21.4,"Oxford watched 1000 AI agents for 180 days - and found the one that works 10x better  Anthropic spen"
123,ChiomaChukwura2,"Chioma Chukwurah ⚛️🥷⚔️",17034,mid,1,5481,130,"startups-gtm",20.9,"Everyone is talking about AI agents.  Very few are asking what happens when those agents need to pro"
124,jumperz,"JUMPERZ",14607,mid,1,9286,105,"models-news",20.7,"anthropic low key panicked here   I don’t think they expected the market to catch up this fast…  bec"
125,bhavesharora02,"Bhavesh Arora",3207,rising,1,1775,57,"ai-teaching",20.7,"Stop wasting hours trying to learn AI. 📘📚  I have already done it for you.  With one list. Zero co"
126,Ericomedia,"ericomedia.dev 🦁(🖥, ☕️).",1943,rising,1,1085,42,"pm-product",20.4,"While y’all were away I became a bad ass technical product manager. Led a business intelligence and "
127,HarrisDecodes,"Harris",66631,mid,2,3510,54,"agents-evals|startups-gtm",20.0,"The founder of Moonshot AI, the team behind Kimi K3, just dropped one of the best technical talks I'"
128,CEOEastAfrica,"CEO East Africa Magazine",19740,mid,1,36994,93,"pm-product",19.9,"#MeettheCIO  James Byaruhanga Managing Director, Roke Cloud.  Roke Cloud is a private edge cloud pla"
129,mdshefat217,"𝙎𝙄𝙁𝘼𝙏",10406,mid,1,640,128,"startups-gtm",19.8,"This is one of the clearest signals we've seen about where Base is heading.  The Base Ecosystem Fund"
130,DataScienceDojo,"Data Science Dojo",228185,large,2,7882,211,"ai-teaching",19.8,"A working 𝐚𝐠𝐞𝐧𝐭𝐢𝐜 𝐀𝐈 𝐬𝐲𝐬𝐭𝐞𝐦 is four layers stacked on top of each other, and each lay"
131,LeonaDeFi,"Leona 🦋",12908,mid,1,1035,134,"coding-ai",19.6,"Good night X fam   The conversation around AI usually starts with code generation.  But that's only "
132,WaldronLewis,"Lewis 🏴󠁧󠁢󠁷󠁬󠁳󠁿",4000,rising,1,8205,50,"pm-product",19.5,"Sam Altman explains why a startup only needs one investor to say yes while a product manager at Goog"
133,e_opore,"Dhanian 🗯️",67691,mid,1,8814,250,"ai-teaching",19.4,"Building AI Agents from Scratch Tutorial Series (AI Era Edition) in 30 days.( If interested say hi �"
134,alexisintech,"Alexis Aguilar",5128,rising,1,9038,58,"pm-product",19.4,"After 3 beautiful years at Clerk, I'm looking for my next opportunity! I had the privilege of helpin"
135,lwastuargo,"Gogo | Dota for Toxicity",27769,mid,1,11281,132,"models-news",19.0,"Pretty sure Claude is running loop engineering on their marketing/commercial plan  - launch arbitrar"
136,thdxr,"dax",147673,large,1,32849,700,"coding-ai",18.9,"when i used to learn a new library or framework i had this urge to come up with an abstraction the m"
137,jacobinfante24,"Jacob Infante",79137,mid,1,18672,210,"agents-evals",18.8,"Good news for the #Bears: the 2027 draft class looks REALLY good at DT  Early in my draft evals, I s"
138,insomnia_vip,"Insomnia",3555,rising,1,3363,50,"agents-evals",18.8,"A 20-YEAR-OLD MICROSOFT AI ENGINEER SAYS MOST PEOPLE ARE LEARNING AI THE WRONG WAY  Instead of jumpi"
139,Wilsonpablo108,"Wilson",9457,rising,1,670,132,"coding-ai",18.7,"Canopy is opening the door for a new generation of builders.  On @CNPYNetwork You no longer need dee"
140,TheOnlyDSC,"David Santa Carla 🦇",139680,large,1,23914,693,"pm-product",18.6,"Just a Product Manager at Google implying he’s in danger because he’s at a park with White people. h"
141,kaiarhodes,"Kaia Rhodes",25714,mid,1,5085,140,"startups-gtm",18.5,"I’m not here to cosplay as a founder to make people comfortable. At 38, I’ve built multiple business"
142,Adi_bulls,"San.Eth 🥷",8822,rising,1,1641,104,"startups-gtm",18.4,"Bullish take noted 🚀 $QUBIC has some genuinely unique angles in the crowded L1/AI-crypto space. Let"
143,teodorio,"teo",5529,rising,1,12507,54,"pm-product",18.3,"The Product Manager who did this should be fired on the spot https://t.co/qcdrhQ2zlC"
144,Object_Zero_,"Object Zero",37370,mid,1,7754,154,"models-news",18.0,"Corporate use of AI  I think 99.99% of people (especially traditional media) are broadly missing the"
145,ridark_eth,"Ridark",9679,rising,1,8208,82,"agents-evals",18.0,"A 3-week-old store is pulling $7,000 week, and its owner barely touches it.  No team. No agency. No "
