date,platform,asset,action,status,url,impressions,likes,comments,reposts,clicks,replies,notes
2026-06-28,campaign,user-requested-lag-audit-2026-06-28-1437,maintenance_check,checked,local-ledger,0,0,0,0,,0,"User asked to check which day it is, where the campaign is lagging, and retry failed surfaces another way. Confirmed Sunday 2026-06-28, sprint Day 2. Lagging: LinkedIn native post 0/1, LinkedIn comment batches 1/2, X reply batches 1/2. X native posts are complete at 2/2."
2026-06-28,linkedin,linkedin-native-post-retry-feed-composer,post,blocked_editor_input,https://www.linkedin.com/feed/,0,0,0,0,,0,"Retried lagging LinkedIn native post through a different path: main feed Start a post composer. Composer opened and visible text editor node was found, but input failed through Playwright fill, DOM click/type, coordinate click plus clipboard paste, and direct shareActive route timed out. No LinkedIn native post was published."
2026-06-28,x,ai-teaching-reply-batch-2-recovery-attempt,reply_batch,blocked_browser_control,https://x.com/search?q=%22Claude%20Code%22%20workflow%20OR%20evals%20OR%20agents&src=typed_query&f=live,0,0,0,0,,0,"After LinkedIn retry failed, attempted to recover lagging X reply batch 2 via X search for Claude Code workflow/evals/agents. X search navigation timed out, then lightweight browser URL check also timed out and reset browser control. No X replies were posted."
2026-06-28,x,ai-teaching-reply-catalin-plan-review-loop,reply,posted,https://x.com/ruchitdalwadi/status/2071196184581112152,0,0,0,0,,0,"Posted no-link X reply under Catalin AI workflow post. Target: https://x.com/catalinmpit/status/2070524685499138279. Draft length 202 chars. Angle: agent questions plan before execution; assumptions first, implementation second, verification last."
2026-06-28,x,ai-teaching-reply-thariq-dynamic-harness-intent,reply,posted,https://x.com/ruchitdalwadi/status/2071196384817225829,0,0,0,0,,0,Posted no-link X reply under Thariq dynamic workflows / Claude Code harness post. Target: https://x.com/trq212/status/2061907337154367865. Draft length 213 chars. Used X reply-intent path to avoid nested/quoted composer ambiguity.
2026-06-28,x,ai-teaching-reply-beamnxw-orchestration-system,reply,posted,https://x.com/ruchitdalwadi/status/2071196464571895929,0,0,0,0,,0,Posted no-link X reply under beamnxw Claude Code guide post. Target: https://x.com/beamnxw/status/2070764536949358943. Draft length 199 chars. Angle: prompts are entry point; orchestration creates reusable system.
2026-06-28,x,ai-teaching-reply-jazii-pattern-recognition-agent,reply,posted,https://x.com/ruchitdalwadi/status/2071196550672638015,0,0,0,0,,0,"Posted no-link X reply under JAZII content-idea agent post. Target: https://x.com/notjazii/status/2067215816664215879. Draft length 201 chars. Angle: durable workflow is pattern capture, classification, testing, and repeatable brief."
2026-06-28,x,ai-teaching-reply-rahul-one-person-company-review,reply,posted,https://x.com/ruchitdalwadi/status/2071196625431892466,0,0,0,0,,0,"Posted no-link X reply under Rahul one-person company / Claude Cowork post. Target: https://x.com/sairahul1/status/2070795168677265758. Draft length 200 chars. Angle: review checkpoints, owner, allowed actions, evidence, exception path."
2026-06-28,x,ai-teaching-reply-avid-second-brain-workflow,reply,posted,https://x.com/ruchitdalwadi/status/2071196708126748902,0,0,0,0,,0,"Posted no-link X reply under Avid AI second brain post. Target: https://x.com/Av1dlive/status/2070507527213871594. Draft length 187 chars. Angle: second brain needs capture, retrieve, synthesize, verify, update, and review loop."
2026-06-28,linkedin,ai-teaching-comment-rahul-ai-workflow-evidence,comment,posted,https://www.linkedin.com/search/results/content/?keywords=AI%20workflow%20agents%20evals&origin=GLOBAL_SEARCH_HEADER,0,0,0,0,,0,"Posted LinkedIn no-link comment under Rahul Singh AI workflow / AI IDE skills post. Comment text visible after submit. Angle: evidence of improvement matters more than tool count; cycle time, failure cases, and sharper review loop."
2026-06-28,linkedin,ai-teaching-comment-agent-workload-review-check,comment,posted,https://www.linkedin.com/search/results/content/?keywords=AI%20workflow%20agents%20evals&origin=GLOBAL_SEARCH_HEADER,0,0,0,0,,0,"Posted LinkedIn no-link comment under AI agents workload poll. Comment text visible after submit. Angle: choose task with clearest input, output, and review check."
2026-06-28,linkedin,ai-teaching-comment-ian-ai-workflow-stack-loop,comment,posted,https://www.linkedin.com/search/results/content/?keywords=AI%20eval%20harness%20workflow&origin=GLOBAL_SEARCH_HEADER,0,0,0,0,,0,"Posted LinkedIn no-link comment under Ian Shkuro daily AI workflow poll. Comment text visible after submit. Angle: stack matters less than workflow capture, context, allowed changes, and proof output is usable."
2026-06-28,linkedin,ai-teaching-comment-ai-makerspace-agent-harnesses,comment,posted,https://www.linkedin.com/search/results/content/?keywords=AI%20eval%20harness%20workflow&origin=GLOBAL_SEARCH_HEADER,0,0,0,0,,0,"Posted LinkedIn no-link comment under AI Makerspace From AI to Agents & Harnesses post. Comment text visible after submit. Angle: model, agent, harness progression; reliability lives in traces, evals, permissions, failure cases, and human review."
2026-06-28,linkedin,ai-teaching-comment-srini-evals-discipline,comment,posted,https://www.linkedin.com/pulse/evals-discipline-why-your-tests-pass-agent-still-lies-srini-karlekar-vvs2e/,0,0,0,0,,0,"Posted LinkedIn no-link comment under Srini Karlekar's Evals as a Discipline article. Comment text visible after submit. Angle: passing tests are not enough if eval does not match workflow; test tool choice, intermediate state, recovery, and user review."
2026-06-28,campaign,heartbeat-2026-06-28-1804-notification-check,maintenance_check,blocked_browser_control,https://x.com/notifications,,0,0,0,,0,"Maintenance heartbeat after completed Day-2 batches. Local state confirmed revised batch plan is caught up: 2 X native posts, 2 X reply batches, 2 LinkedIn comment batches; LinkedIn native remains 0/1 due composer input failures. Attempted X notifications first, but the page read timed out and reset browser control; follow-up lightweight reconnect also timed out. No LinkedIn check or public action attempted after browser-control failure. Next action: retry inbound checks first once browser is responsive."
2026-06-28,campaign,heartbeat-2026-06-28-2201-notification-check,maintenance_check,checked,https://x.com/notifications,0,0,0,0,,0,"Late Day-2 maintenance check. Local state confirmed revised batch plan is caught up. X notifications showed Avid liked the second-brain reply and JAZII liked the pattern-recognition reply from today's batch, plus older likes/repost/follows; no new substantive reply required a response."
2026-06-28,campaign,heartbeat-2026-06-28-2201-linkedin-notifications,maintenance_check,checked,https://www.linkedin.com/notifications/?filter=all,0,0,0,0,,0,"Late Day-2 LinkedIn notifications check showed suggested pages/jobs including Inception Studio, AI Product Manager jobs, Aakash Gupta page, and Lyzr AI; no campaign-quality inbound reply required a response."
2026-06-29,campaign,heartbeat-2026-06-29-0203-x-notifications,maintenance_check,checked,https://x.com/notifications,0,0,0,0,,0,Day 3 kickoff check. X notifications showed Avid and JAZII likes on Day-2 replies plus older likes/repost/follows; no new substantive inbound reply required a response.
2026-06-29,campaign,heartbeat-2026-06-29-0203-linkedin-notifications,maintenance_check,checked,https://www.linkedin.com/notifications/?filter=all,0,0,0,0,,0,"Day 3 kickoff check. LinkedIn notifications showed suggested pages/jobs including Inception Studio, AI Product Manager jobs, Aakash Gupta page, and Lyzr AI; no campaign-quality inbound reply required a response."
2026-06-29,x,ai-teaching-evals-define-good-native-post,post,posted,https://x.com/ruchitdalwadi/status/2071331138916974862,0,0,0,0,,0,"Posted first Day-3 native X post after clean inbound checks. Topic: AI demos fail when nobody defines what good means; tiny eval = good/bad examples, allowed tools, expected output, failure cases, review owner. Verified visible on profile. Draft length 258 chars."
2026-06-29,campaign,heartbeat-2026-06-29-0613-x-notifications,maintenance_check,checked,https://x.com/notifications,0,0,0,0,,0,Day 3 first distribution block checked X notifications first. Visible items were likes/reposts/follows including Avid and JAZII likes from Day-2 replies plus older activity; no substantive inbound reply required response.
2026-06-29,campaign,heartbeat-2026-06-29-0613-linkedin-notifications,maintenance_check,checked,https://www.linkedin.com/notifications/?filter=all,0,0,0,0,,0,"Day 3 first distribution block checked LinkedIn notifications. Latest visible items were Monday Jobs Report, suggested pages/jobs, and a 13-day-old direct message from Krishi Bhagchandani. No public campaign-quality inbound reply required response; no DM was sent."
2026-06-29,linkedin,ai-teaching-comment-shubham-agent-zero-loop,comment,posted,https://www.linkedin.com/search/results/content/?keywords=agentic%20AI%20evals%20review%20loop&origin=GLOBAL_SEARCH_HEADER,0,0,0,0,,0,"Posted and verified LinkedIn no-link comment under Shubham Saboo / Agent Zero search result about loop engineering. Angle: useful agent test is whether it can plan, check, retry, and hand off with evidence a human can trust."
2026-06-29,linkedin,ai-teaching-comment-ali-agent-loop-cron-eval,comment,posted,https://www.linkedin.com/search/results/content/?keywords=agentic%20AI%20evals%20review%20loop&origin=GLOBAL_SEARCH_HEADER,0,0,0,0,,0,"Posted and verified LinkedIn no-link comment under Ali Raza looping agents post. Angle: cron-style agent loops expose trigger, context, permissions, eval, review path, and risky-action handling."
2026-06-29,linkedin,ai-teaching-comment-lydia-governance-surface,comment,posted,https://www.linkedin.com/search/results/content/?keywords=Claude%20Code%20evals%20workflow&origin=GLOBAL_SEARCH_HEADER,0,0,0,0,,0,"Posted and verified LinkedIn no-link comment under Lydia Delyova Kiro vs Claude / governance surface area search result. Angle: tool choice is increasingly about permissions, audit trail, evals, and safe review."
2026-06-29,linkedin,ai-teaching-comment-github-loop-contract,comment,posted,https://www.linkedin.com/search/results/content/?keywords=AI%20coding%20agents%20review%20loop&origin=GLOBAL_SEARCH_HEADER,0,0,0,0,,0,"Posted and verified LinkedIn no-link comment under GitHub loop-engineering LinkedIn Live post. Angle: treat each loop as a contract with goal, context, allowed actions, check step, retry rule, and human review point."
2026-06-29,linkedin,ai-teaching-comment-kartik-spec-review-loop,comment,posted,https://www.linkedin.com/search/results/content/?keywords=%22Spec-Driven%20Development%20With%20AI%20Agents%22&origin=GLOBAL_SEARCH_HEADER,0,0,0,0,,0,"Posted and verified LinkedIn no-link comment under Kartik Raghavan spec-driven development with AI agents post. Angle: second-agent review catches misunderstood requirements, overbuilt scope, missing edges, and untestable acceptance criteria."
2026-06-29,campaign,heartbeat-2026-06-29-1016-x-notifications,maintenance_check,checked,https://x.com/notifications,0,0,0,0,,0,Day 3 10:16 IST check inspected X notifications first. Visible items were likes/reposts/follows and older already-handled replies; no substantive inbound reply required response.
2026-06-29,campaign,heartbeat-2026-06-29-1016-linkedin-notifications,maintenance_check,checked,https://www.linkedin.com/notifications/?filter=all,0,0,0,0,,0,Day 3 10:16 IST check inspected LinkedIn notifications. Visible items were jobs/suggestions plus the same 13-day-old direct message; no public campaign-quality inbound required response and no DM was sent.
2026-06-29,x,ai-teaching-reply-jason-claude-sessions-review-surface,reply,posted,https://x.com/ruchitdalwadi/status/2071455933730001058,0,0,0,0,,0,"Posted and verified no-link X reply under Jason Zhou Claude Code sessions / loops post. Target: https://x.com/jasonzhou1993/status/2069413003897012435. Target had about 11 replies, 29 reposts, 210 likes, 78K views. Draft length 215 chars. Angle: parallel sessions need a review surface with owner, scope, tests, failed assumptions, and handoff."
2026-06-29,x,ai-teaching-reply-mike-content-agent-editor-loop,reply,posted,https://x.com/ruchitdalwadi/status/2071455971491352894,0,0,0,0,,0,"Posted and verified no-link X reply under MIKE Claude content machine post. Target: https://x.com/mikenevermiss/status/2070382112088236427. Target had about 17 replies, 42 reposts, 259 likes, 2.9M views. Draft length 213 chars. Angle: durable content agents need an editor loop with examples, rejection criteria, and brief updates."
2026-06-29,x,ai-teaching-reply-lummox-claude-engineer-constraints,reply,posted,https://x.com/ruchitdalwadi/status/2071456013522477552,0,0,0,0,,0,"Posted and verified no-link X reply under Lummox Claude Code as software engineer post. Target: https://x.com/Lummox_eth/status/2071291078494609564. Target had about 25 replies, 7 reposts, 61 likes, 3.1K views. Draft length 205 chars. Angle: treating Claude Code like an engineer means constraints: explore, plan, touch fewer files, run checks, explain tradeoff."
2026-06-29,x,ai-teaching-reply-archive-claude-folder-memory,reply,posted,https://x.com/ruchitdalwadi/status/2071456055528452278,0,0,0,0,,0,"Posted and verified no-link X reply under Archive Claude loop/folder post. Target: https://x.com/ArchiveExplorer/status/2071192832455430283. Target had about 13 replies, 32 reposts, 192 likes, 19K views. Draft length 188 chars. Angle: .claude folder as operating memory: conventions, commands, examples, review rules, allowed changes."
2026-06-29,x,ai-teaching-reply-codez-self-improving-evals,reply,posted,https://x.com/ruchitdalwadi/status/2071456097685377085,0,0,0,0,,0,"Posted and verified no-link X reply under Codez self-improving loops post. Target: https://x.com/0xCodez/status/2071239626128298131. Target had about 26 replies, 62 reposts, 517 likes, 129K views. Draft length 199 chars. Angle: self-improving loops need measurable eval set, expected output, bad examples, tools, stop conditions, and human escalation."
2026-06-29,x,ai-teaching-reply-andrew-audited-autonomy,reply,posted,https://x.com/ruchitdalwadi/status/2071456139670343804,0,0,0,0,,0,"Posted and verified no-link X reply under Andrew AI coding delegation post. Target: https://x.com/s4yonnara/status/2070828636177916150. Target had about 10 replies, 8 reposts, 54 likes, 2.4K views. Draft length 203 chars. Angle: practical move is audited autonomy: small scopes, acceptance tests, visible tool calls, and fast human handoff."
2026-06-29,linkedin,linkedin-broad-keyword-comment-batch-2-attempt,comment_batch,blocked_browser_control,https://www.linkedin.com/search/results/content/?keywords=context%20engineering%20AI%20agents&origin=GLOBAL_SEARCH_HEADER,0,0,0,0,,0,"User asked to go ahead on LinkedIn comments and broaden keyword search. Tried LinkedIn notification check first, but the notification page timed out and reset browser control. Recovered via a fresh tab and searched broader lanes including context engineering AI agents. Found Pavan Belagatti JIRA bugs / AI agents post with 103 reactions and attempted a comment about preserving context, repro steps, affected files, allowed changes, tests, and human review before merge. Submit/verification timed out; outcome unknown and not counted. Alternate hashtag feed route also timed out."
2026-06-29,x,ai-teaching-tools-vs-systems-native-post-attempt,post,posted,https://x.com/ruchitdalwadi/status/2071462093031878721,2,0,0,0,,0,"Verified previously unknown second Day-3 native X post on profile during 14:17 IST heartbeat. Text begins: 'Most people learn AI backwards.' Angle: collect tools last; pick one workflow, write steps, mark judgment, add context/constraints, add review check, repeat until output is predictable. Visible profile evidence showed 2 views."
2026-06-29,campaign,heartbeat-2026-06-29-1417-automation-strategy-update,maintenance_check,checked,local-automation-config,0,0,0,0,,0,"Updated recurring heartbeat automation to reflect revised strategy: broader practical AI teaching, medium-hot rooms over only mega-viral posts, LinkedIn as first-class channel, 5-6 batch size, sharper comments, broader keyword lanes, and tracking replies/profile signal rather than activity alone."
2026-06-29,campaign,heartbeat-2026-06-29-1417-x-notifications,maintenance_check,blocked_browser_control,https://x.com/notifications,0,0,0,0,,0,"Attempted X notifications after verifying second native X post. Notifications navigation/read timed out and reset browser control, so no substantive inbound check was completed."
2026-06-29,linkedin,linkedin-broad-ai-workflow-comment-retry,comment_batch,blocked_browser_control,https://www.linkedin.com/search/results/content/?keywords=AI%20workflow%20productivity&origin=GLOBAL_SEARCH_HEADER,0,0,0,0,,0,"Retried LinkedIn comments from a fresh search tab using broader keyword lane AI workflow productivity. LinkedIn loaded and first visible result was too cold at 8 reactions; attempted scroll to find medium-hot rooms, but browser-control timed out/reset. No LinkedIn comment posted or counted."
2026-06-29,campaign,daily-schedule-update-2026-06-29,strategy_update,updated,local-automation-and-daily-operating-schedule,0,0,0,0,,0,"Added explicit everyday schedule to automation and daily-operating-schedule.md: 2 X native posts/day, 1 LinkedIn native post/day or comment fallback, 3 X reply batches/day of 5-6 replies, 3 LinkedIn comment batches/day of 5 comments, and 4-hour inbound checks. Added IST operating windows: morning LinkedIn batch + X native; midday X and LinkedIn batches; evening LinkedIn native/fallback + X native; late X batch + review."
2026-06-29,campaign,daily-schedule-window-update-2026-06-29,strategy_update,updated,local-automation-and-daily-operating-schedule,0,0,0,0,,0,"Constrained everyday campaign schedule to 10:00-22:00 IST only. Updated heartbeat RRULE to daily slots at 10:00, 14:00, 18:00, and 22:00 IST. Updated daily-operating-schedule.md windows: 10:00-12:00 morning, 14:00-16:00 midday, 18:00-20:00 evening, 20:00-22:00 late; no new public actions after 22:00 IST."
2026-06-29,linkedin,ai-teaching-comment-kanchan-pm-decision-loop,comment,posted,https://www.linkedin.com/search/results/content/?keywords=AI%20for%20PMs%20product%20managers%20workflow&origin=GLOBAL_SEARCH_HEADER,0,0,0,0,,0,"Posted and verified LinkedIn no-link comment under Kanchan Kumari's 100 AI use cases for PMs post. Target showed 73 reactions and 24 comments visible after posting. Angle: PMs should define the decision loop before collecting AI prompts; research, synthesize, decide, build, measure, with PM judgment retained."
2026-06-29,linkedin,ai-teaching-comment-tejas-cursor-pm-workspace,comment,posted,https://www.linkedin.com/search/results/content/?keywords=AI%20for%20PMs%20product%20managers%20workflow&origin=GLOBAL_SEARCH_HEADER,0,0,0,0,,0,"Posted and verified LinkedIn no-link comment under Tejas Mahesh Paradkar's Cursor / Product Management Agent OS post. Target showed 84 reactions and 10 comments. Angle: Cursor should be a PM workspace for context, rules, examples, and handoffs, not just a PRD writer."
2026-06-29,linkedin,ai-teaching-comment-pavan-jira-agents-context,comment,posted,https://www.linkedin.com/search/results/content/?keywords=context%20engineering%20AI%20agents&origin=GLOBAL_SEARCH_HEADER,0,0,0,0,,0,"Posted and verified LinkedIn no-link comment under Pavan Belagatti's AI agents / JIRA workflow article. Target showed 103 reactions and 6 comments. Angle: assigning a JIRA ticket is easy; safe agent fixes need context, repro steps, affected files, allowed changes, tests run, and human review before merge."
2026-06-29,linkedin,ai-teaching-comment-anuj-tools-before-workflows,comment,posted,https://www.linkedin.com/search/results/content/?keywords=AI%20agents%20workflow%20business&origin=GLOBAL_SEARCH_HEADER,0,0,0,0,,0,"Posted and verified LinkedIn no-link comment under Anuj J.'s AI agents workflow business post. Target showed 517 reactions and 31 comments. Angle: teams buy AI tools too early; first pick one recurring decision, write handoff/review rules, then choose the tool that makes the loop cheaper."
2026-06-29,linkedin,ai-teaching-comment-jasmeet-ai-first-pm-signal,comment,posted,https://www.linkedin.com/search/results/content/?keywords=AI%20for%20PMs%20product%20managers%20workflow&origin=GLOBAL_SEARCH_HEADER,0,0,0,0,,0,"Posted and verified LinkedIn no-link comment under Jasmeet Arora's AI-first Senior Product Manager post. Target showed 94 reactions and 11 comments. Angle: AI-first PM signal is understanding where AI changes discovery, decision quality, workflow cost, and measurement without outsourcing product judgment."
2026-06-29,campaign,heartbeat-2026-06-29-1801-x-notifications,maintenance_check,checked,https://x.com/notifications,0,0,0,0,,0,"18:00 IST block checked X notifications first. Visible items were Andrew like on today's audited-autonomy reply, Avid/JAZII likes from Day-2 replies, older likes/reposts/follows; no substantive public inbound reply required response."
2026-06-29,campaign,heartbeat-2026-06-29-1801-linkedin-notifications,maintenance_check,checked,https://www.linkedin.com/notifications/?filter=all,0,0,0,0,,0,"18:00 IST block checked LinkedIn notifications. Visible items were search appearance, AI Product Manager job recommendations, Monday jobs report, and page suggestions; no public campaign-quality inbound reply required response."
2026-06-29,linkedin,linkedin-native-post-retry-2026-06-29-1801,post,blocked_editor_input,https://www.linkedin.com/feed/,0,0,0,0,,0,"Attempted scheduled LinkedIn native post from feed composer. Composer opened and exposed the native content editor, but Playwright fill failed with active element mismatch and direct DOM typing inserted no text; Post button stayed disabled. No LinkedIn native post published."
2026-06-29,x,ai-teaching-reply-batch-2-evening-attempt,reply_batch,blocked_editor_input,https://x.com/ruchitdalwadi/with_replies,0,0,0,0,,0,"Attempted second Day-3 X reply batch after LinkedIn searches went cold. X intent composer did not prefill text, disabled reply buttons caused four initial attempts not to post, and manual tweet-page reply route accepted text only after extra scrolling but still did not verify on profile after submit. No X reply counted."
2026-06-29,linkedin,ai-teaching-comment-ai-work-tools-vs-loop,comment,posted,https://www.linkedin.com/search/results/content/?keywords=AI%20for%20work%20workflow%20ChatGPT&origin=GLOBAL_SEARCH_HEADER,0,0,0,0,,0,"Posted and verified LinkedIn no-link fallback comment under Vipin Gautam / JAI JAIN AI productivity workflow post. Target showed 1,065 reactions and 176 comments; used despite being crowded because medium-hot searches were cold. Angle: people need repeatable workflows with context, constraints, expected output, and review, not more AI tools."
2026-06-29,linkedin,ai-teaching-comment-applied-ai-forward-deployed-workflow,comment,posted,https://www.linkedin.com/search/results/content/?keywords=AI%20product%20management%20workflow&origin=GLOBAL_SEARCH_HEADER,0,0,0,0,,0,"Posted and verified LinkedIn no-link fallback comment under Shubham Choudhary's applied AI / forward-deployed account manager article. Target showed 59 reactions and 4 comments. Angle: applied AI fails in handoff, not demo; valuable role translates messy customer workflow into context, constraints, acceptance criteria, and review loop."
2026-06-29,linkedin,linkedin-evening-comment-fallback-partial,comment_batch,partial_posted,https://www.linkedin.com/search/results/content/?keywords=AI%20agents%20workflows%20operators&origin=GLOBAL_SEARCH_HEADER,0,0,0,0,,0,"18:00 IST LinkedIn native fallback attempted to form comment batch 3. Verified 2 LinkedIn comments, but did not count as a completed batch because multiple broadened searches went cold/job-heavy or hit duplicate targets: AI for work workflow ChatGPT, AI automation business workflow, AI founders workflow, AI product management workflow, context engineering AI workflow, prompt engineering AI workflow, and AI agents workflows operators."
2026-06-29,campaign,user-approved-after-cutoff-continuation-2026-06-29,maintenance_check,checked,local-user-override,0,0,0,0,,0,"User explicitly said continue for today at 22:12 IST, overriding the normal 22:00 cutoff for this run. Continued only with public comments/replies; no DMs, emails, uploads, profile edits, paid actions, or security changes."
2026-06-29,linkedin,ai-teaching-comment-deepu-human-in-loop-cost,comment,posted,https://www.linkedin.com/search/results/content/?keywords=AI%20agents%20review%20loop%20workflow&origin=GLOBAL_SEARCH_HEADER,0,0,0,0,,0,"Posted and verified LinkedIn no-link comment under Deepu Prakash's Agentic AI: when should a human stay in the loop? article. Target showed 24 reactions and 15 comments. Angle: keep humans in the loop anywhere agents can create irreversible cost: money, customer trust, production data, legal exposure, or roadmap commitments."
2026-06-29,linkedin,ai-teaching-comment-mayur-human-loop-coding-agents,comment,posted,https://www.linkedin.com/search/results/content/?keywords=human%20in%20the%20loop%20AI%20agents&origin=GLOBAL_SEARCH_HEADER,0,0,0,0,,0,"Posted and verified LinkedIn no-link comment under Mayur Upadhyay's human-in-the-loop / coding agents video post. Target showed 28 reactions and 2 comments. Angle: human-in-the-loop is not a final checkbox; coding-agent workflows need scope, allowed files, tests, diff review, rollback path, and stop condition."
