date,platform,asset,action,status,url,impressions,likes,comments,reposts,clicks,replies,notes
2026-07-02,linkedin,day-6-shivani-ai-agents-workflow-roles-comment,comment,posted,https://www.linkedin.com/search/results/content/?keywords=AI%20workflow&origin=GLOBAL_SEARCH_HEADER,,,,,,0,"Verified in-page on Shivani Sisodiya / Ai Mindshare AI agents workflow post. Comment angle: agent collaboration is workflow role design: planner, drafter, checker, operator, reviewer, and handoff artifacts."
2026-07-02,x,day-6-david-ai-workspace-quality-gate-reply,reply,posted,https://x.com/ruchitdalwadi/status/2072582958490534151,1400,106,30,60,,0,"Posted and verified X reply under David Marco's AI workspace/systems thread. Target showed 1.4K views, 106 likes, 30 replies, and 60 reposts before/around posting. Angle: save one shippable output and one rejected output so the AI compares against both before drafting."
2026-07-02,x,day-6-freecodecamp-claude-code-rules-reply,reply,posted,https://x.com/ruchitdalwadi/status/2072583182986412152,8840,61,16,43,,0,"Posted and verified X reply under freeCodeCamp Claude Code Flutter structure/rules post. Target showed 8,840 views, 61 likes, 16 replies, and 43 reposts before posting. Angle: agents should list touched files and the smallest relevant test before editing."
2026-07-02,x,day-6-olly-context-library-reject-examples-reply,reply,posted,https://x.com/ruchitdalwadi/status/2072583262879527378,2893,23,1,2,,0,"Posted and verified X reply under Olly Hudson Claude/context library post. Target showed 2,893 views, 23 likes, 1 reply, and 2 reposts before posting. Angle: context libraries need source of truth, imitate examples, reject examples, and current constraints."
2026-07-02,x,day-6-langchain-agent-eval-observability-reply,reply,posted,https://x.com/ruchitdalwadi/status/2072583421755605027,39000,69,2,19,,0,"Posted and verified X reply under LangChain Harbor agent eval stack post. Target showed 39K views, 69 likes, 2 replies, and 19 reposts before posting. Angle: agent evals need observable failure traces: goal, tools, files, uncertainty, final diff/output."
2026-07-02,x,day-6-cognition-routing-merge-eval-reply,reply,posted,https://x.com/ruchitdalwadi/status/2072583522460783102,512200,1100,77,249,,0,"Posted and verified X reply under Cognition Devin Fusion model-routing post. Target showed 512.2K views, 1.1K likes, 77 replies, and 249 reposts before posting. Angle: route models against production-like merge criteria, not generic benchmarks."
2026-07-02,x,day-6-x-premium-reply-batch-2,reply_batch,posted,https://x.com/ruchitdalwadi/with_replies,564333,1359,126,373,,5,"Completed second Day 6 X reply batch with 5 verified replies across three lane families: operator AI workflows, Claude/coding workflows, and agents/evals/model routing. Reply URLs: 2072582958490534151, 2072583182986412152, 2072583262879527378, 2072583421755605027, 2072583522460783102."
2026-07-02,linkedin,day-6-vornix-ai-ops-workflow-automation-comment,comment,posted,https://www.linkedin.com/search/results/content/?keywords=AI%20for%20work%20operators&origin=GLOBAL_SEARCH_HEADER,,,,,,0,"Verified in-page on Vornix Solutions AI operations workflow poll. Target showed 1 poll vote before posting. Comment angle: workflow automation should start with one recurring process, one owner, one approval point, and one exception path."
2026-07-02,linkedin,day-6-gordian-ai-work-productivity-workflow-comment,comment,posted,https://www.linkedin.com/search/results/content/?keywords=AI%20for%20work%20operators&origin=GLOBAL_SEARCH_HEADER,,,,,,0,"Verified in-page on Gordian Staffing Careers AI-at-work productivity poll. Target showed 13 poll votes before posting. Comment angle: the useful gain is saving time across a recurring deliverable, from context gathering to review to making the next run easier."
2026-07-02,linkedin,day-6-dev-ai-learning-coding-review-note-comment,comment,posted,https://www.linkedin.com/search/results/content/?keywords=AI%20coding%20workflow&origin=GLOBAL_SEARCH_HEADER,,18,6,,,0,"Verified in-page on Dev Mohite's AI productivity, learning, and coding article. Target showed 18 reactions and 6 comments before posting. Comment angle: keep a review note beside AI output so productivity compounds into skill rather than just faster output."
2026-07-02,linkedin,day-6-srinivas-agentic-coding-boundaries-comment,comment,posted,https://www.linkedin.com/search/results/content/?keywords=AI%20coding%20workflow&origin=GLOBAL_SEARCH_HEADER,,,,,,0,"Verified in-page on Srinivas Gutta's agentic AI/software developer orchestration post. Comment angle: developers need to specify files, evidence, tests, and stop conditions before agentic coding becomes usable at work."
2026-07-02,linkedin,day-6-alex-ai-teammates-production-contract-comment,comment,posted,https://www.linkedin.com/search/results/content/?keywords=AI%20agents%20evals%20workflow&origin=GLOBAL_SEARCH_HEADER,,,,,,0,"Verified in-page on Alex Padaliya's production AI teammate / AI engineering post. Comment angle: AI teammates need an operating contract covering retrievable context, allowed tools, trace, eval, and human takeover point."
2026-07-02,linkedin,day-6-linkedin-comment-batch-2,comment_batch,posted,https://www.linkedin.com/search/results/content/?keywords=AI%20agents%20evals%20workflow&origin=GLOBAL_SEARCH_HEADER,,18,6,,,5,"Completed second Day 6 LinkedIn comment batch with 5 verified no-link comments across AI-at-work operators, AI coding workflow, and agents/evals workflow lanes. Sparse visible counters on several poll/search posts; Dev Mohite target showed 18 reactions and 6 comments before posting."
2026-07-02,x,day-6-myttle-claude-tag-shared-handoff-reply,reply,posted,https://x.com/ruchitdalwadi/status/2072605730222604339,1400,34,8,4,,0,"Posted and verified X reply under Myttle's Claude Tag/shared AI handoff post. Target showed 1.4K views, 34 likes, 8 replies, and 4 reposts before posting. Angle: visible request/context/plan/result/correction turns AI into reviewable team memory."
2026-07-02,x,day-6-ai-guides-agent-skill-harness-reply,reply,posted,https://x.com/ruchitdalwadi/status/2072605792063402218,3500,26,4,20,,0,"Posted and verified X reply under AI Guides / Tejas agent-skill harness post. Target showed 3.5K views, 26 likes, 4 replies, and 20 reposts before posting. Angle: test harness value by changing inputs, tools, examples, checks, and retry rules without changing prompt text."
2026-07-02,x,day-6-daily-dose-agent-harness-architecture-reply,reply,posted,https://x.com/ruchitdalwadi/status/2072605862242537791,24000,348,8,79,,0,"Posted and verified X reply under Daily Dose of Data Science's agent harness architecture post. Target showed 24K views, 348 likes, 8 replies, and 79 reposts before posting. Angle: the harness should own context gathering, tool choice, uncertainty logging, memory, and trace exposure."
2026-07-02,x,day-6-maestro-mcp-coding-agent-flow-reply,reply,posted,https://x.com/ruchitdalwadi/status/2072605926948053467,2200,33,2,2,,0,"Posted and verified X reply under Maestro MCP screen-driving coding-agent flow. Target showed 2.2K views, 33 likes, 2 replies, and 2 reposts before posting. Angle: evaluate coding agents by whether they can run the user flow, see the broken state, fix it, and rerun."
2026-07-02,x,day-6-kuch-claude-code-folder-agent-reply,reply,posted,https://x.com/ruchitdalwadi/status/2072605989745099113,2000,27,11,1,,0,"Posted and verified X reply under kuch's Claude Code folder/CLAUDE.md beginner-agent post. Target showed 2K views, 27 likes, 11 replies, and 1 repost before posting. Angle: add bad-output examples so the agent compares against rejects, not only instructions."
2026-07-02,x,day-6-x-premium-reply-batch-3,reply_batch,posted,https://x.com/ruchitdalwadi/with_replies,33100,468,33,106,,5,"Completed third Day 6 X reply batch with 5 verified replies across operator AI workflow, agents/evals/harnesses, and AI coding workflow lanes. Reply URLs: 2072605730222604339, 2072605792063402218, 2072605862242537791, 2072605926948053467, 2072605989745099113."
2026-07-02,linkedin,day-6-linkedin-native-rejected-output-workflow,native_post,posted,https://www.linkedin.com/feed/update/urn:li:share:7478382489783144448/,,,,,,0,"Posted via Composio LinkedIn native post creation. Durable share URN returned: urn:li:share:7478382489783144448. Composio GET_POST_CONTENT verification returned 403 Forbidden, so content read-back was unavailable; creation response was successful. Post teaches a rejected-output workflow note: task, missing context, premature decision, 30-second reviewer check, and never-change-without-asking rule."
2026-07-02,x,day-6-1558-ist-x-native-browser-health-check,native_post_recovery,blocked_browser_timeout,https://x.com/compose/post,,,,,,0,"Heartbeat found no due retry rows and Day 6 still behind on X native posts. Attempted browser-based X native recovery, but two tab-level browser health checks timed out before any X page or composer could be inspected. No public action posted; X native gap preserved. Tool path: browser X."
2026-07-02,campaign,day-6-1300-ist-post-stats-refresh,stats_refresh,blocked_tool_timeout,,,,,,,0,"Daily post-stats refresh was due and checked 21 active registry rows. Composio LinkedIn read-back attempt timed out after 300s; browser X/browser LinkedIn stats were skipped because the most recent two tab-level browser health checks timed out. No stats updated and no public action taken."
2026-07-03,linkedin,day-7-linkedin-native-agent-handoff-card,native_post,posted,https://www.linkedin.com/feed/update/urn:li:share:7478665802834038785/,,,,,,0,"Posted native LinkedIn text post through Composio as urn:li:share:7478665802834038785. Tool path: Composio LinkedIn. GET_POST_CONTENT read-back returned 403 Forbidden, so visible stats remain blank until the 13:00 IST refresh or a later browser-safe checkpoint. Browser X and browser-native LinkedIn were not attempted because the latest two browser health checks still failed below platform. No DM, email, upload, profile edit, paid action, or security/account change was made."
2026-07-03,campaign,day-7-1300-ist-post-stats-refresh,stats_refresh,blocked_tool_limitation,,,,,,,0,"Daily 13:00 IST post-stats refresh was due and checked 22 active registry rows. Composio LinkedIn GET_POST_CONTENT returned 403 Forbidden for both active native share URNs; LINKEDIN_GET_SHARE_STATS is organization-scoped and not applicable to personal profile shares. Browser X/browser LinkedIn stats were skipped because the most recent two tab-level browser health checks timed out. No stats updated and no public action taken."
2026-07-03,linkedin,day-7-1426-ist-linkedin-comment-block,comment_batch,blocked_no_accessible_target,,,,,,,0,"14:00 IST LinkedIn comment block checked Composio LinkedIn capabilities while browser remained gated. Connection was active and LINKEDIN_CREATE_COMMENT_ON_POST is available, but it requires a concrete urn:li:share or urn:li:ugcPost target; Composio did not provide LinkedIn public post search, activity URNs are unsupported, and existing browser-search targets have no durable commentable share/ugcPost URNs. No comment posted and no browser fallback attempted."
2026-07-03,x,day-7-1751-ist-user-requested-x-browser-retry,browser_health_check,blocked_browser_timeout,,,,,,,0,"User asked to try X/browser automation again. Browser setup connected and initial discovery partly responded: selected tab returned null, browser tab list returned empty, and user open tabs returned empty. Fresh tab creation timed out after 20s. After reconnect, selected-tab lookup timed out after 10s and fresh tab creation timed out after 20s. No X page inspected and no public action taken."
2026-07-04,linkedin,day-8-linkedin-native-model-switch-note,native_post,posted,https://www.linkedin.com/feed/update/urn:li:share:7479030295779004416/,,,,,,0,"Posted native LinkedIn text post through Composio as urn:li:share:7479030295779004416. Tool path: Composio LinkedIn. Identity verified first as Ruchit D / urn:li:person:q_REAAY3_T. GET_POST_CONTENT read-back was not attempted because COMPOSIO_GET_TOOL_SCHEMAS for that tool failed with a Composio transport HTTP request error. Post teaches a model-switch decision rule using task, current failure, test set, pass bar, and fallback."
2026-07-04,campaign,day-8-1300-ist-post-stats-refresh,stats_refresh,partial_stats_refresh,,,,,,,0,"Daily 13:00 IST stats refresh checked 23 active registry rows. Composio LinkedIn GET_POST_CONTENT returned 403 Forbidden for all 3 active native personal share URNs; LINKEDIN_GET_SHARE_STATS is organization-scoped and not applicable to personal profile shares. LIST_REACTIONS returned verified reaction totals for the 3 native shares: day-8 model-switch note=2, day-7 agent handoff card=0, day-6 rejected-output workflow=2. Browser X/browser LinkedIn stats were skipped because the latest browser retry failed below platform. No public action taken."
2026-07-04,x,day-8-x-native-demo-vs-product-discipline,native_post,posted,https://x.com/ruchitdalwadi/status/2073364437789188264,,,,,,0,"Discovered in post-stats-registry as official API x-publish.mjs output and reconciled at 17:11 IST. Status ID snowflake decodes to 2026-07-04T16:42:57+05:30. No browser action was taken."
2026-07-04,linkedin,day-8-linkedin-native-content-bank-auto,native_post,posted,https://www.linkedin.com/feed/update/urn:li:share:7479146031931322369/,,,,,,0,"Discovered in post-stats-registry as Composio REST own-project output and reconciled at 17:56 IST. Stable URN: urn:li:share:7479146031931322369. No browser action was taken."
2026-07-04,x,day-8-x-native-failure-template,native_post,posted,https://x.com/ruchitdalwadi/status/2073383497478377535,0,0,0,0,,0,"Posted via official API x-publish.mjs after whoami verified @ruchitdalwadi. API returned text shortened at final phrase to 'It will just fail'. Immediate API stats showed 0 impressions, 0 likes, 0 replies, 0 reposts, 0 bookmarks."
2026-07-04,x,day-8-x-native-trend-gemini-1803,native_post,posted,https://x.com/ruchitdalwadi/status/2073384593697468521,9,0,1,0,,0,"Discovered in post-stats-registry as GitHub Action trend agent output and verified via X API at 18:42 IST. Immediate stats: 9 impressions, 0 likes, 1 reply, 0 reposts, 0 bookmarks."
2026-07-04,x,day-8-x-native-trend-gemini-1758-not-found,native_post,not_found,https://x.com/ruchitdalwadi/status/2073383436920955152,,,,,,0,"Discovered in post-stats-registry as GitHub Action trend agent output, but X API stats returned Not Found at 18:42 IST. Not counted as a verified public post."
2026-07-06,campaign,day-10-comment-session-1,comment_session,posted,https://x.com/ruchitdalwadi/with_replies,212128,1488,135,70,,4,"Completed cold comment session through browser with screenshot verification before submit and 2+ minute spacing. Posted 3 verified X replies under Delba, cat, and Jacob plus 1 browser-verified LinkedIn comment under Jaibharath Ganesan's AI coding cognitive debt post. X reply URLs: https://x.com/ruchitdalwadi/status/2074052602887852519, https://x.com/ruchitdalwadi/status/2074053543485751531, https://x.com/ruchitdalwadi/status/2074054866172080480. LinkedIn permalink pending; target article URL saved."
2026-07-08,x,day-12-comment-session-1,comment_session,posted,https://x.com/ruchitdalwadi/with_replies,915536,2795,135,,,3,"Completed cold comment session through browser with user-waived screenshot verification, visible-DOM composer checks, keyboard submit, 2+ minute spacing, and twitterapi.io verification. Posted 3 verified X replies: emollick Sol/Fable harness https://x.com/ruchitdalwadi/status/2074788805706748349, bindureddy router eval https://x.com/ruchitdalwadi/status/2074789416154063030, kimmonismus model-launch eval ritual https://x.com/ruchitdalwadi/status/2074790170713604182. LinkedIn attempted on Ashish Grover article but editor rejected corrected paste path; Composio comment fallback requires share/ugcPost URN and article URL did not provide one."
2026-07-08,x,day-12-comment-session-2,comment_session,posted,https://x.com/ruchitdalwadi/with_replies,332755,2672,195,,,3,"After updating comment-session gate to 2.5 hours, completed another cold comment session through browser with user-waived screenshot verification, page-state composer checks, keyboard submit, 2+ minute spacing, and twitterapi.io verification. Posted 3 verified X replies: muratcan harness-loop brake https://x.com/ruchitdalwadi/status/2074837728517361879, Av1dlive Claude Code flow checks https://x.com/ruchitdalwadi/status/2074838321419952154, mattshumer_ model-failure-mode comparison https://x.com/ruchitdalwadi/status/2074839528670695435. LinkedIn sampled 16 lanes and attempted Andras Horvath Wrike AI agents article; browser editor rejected type and clipboard paste, and Composio GET_POST_CONTENT returned 403 for urn:li:ugcPost:7480294186626326529, so no LinkedIn comment was posted."
2026-07-08,campaign,day-12-comment-session-3,comment_session,partial_with_accidental_native,https://x.com/ruchitdalwadi/with_replies,73177,886,61,,,3,"Cold comment session with user-waived screenshot verification. LinkedIn browser comment landed on Siddharth Bhalsod's LLM eval article; X replies verified by twitterapi.io under synthwavedd and Cloudflare. A stale-focus browser submit also created unintended native X post https://x.com/ruchitdalwadi/status/2074881271621198245, so public actions were stopped after verification. No DMs, follows, likes, reposts, profile edits, paid actions, uploads, or account/security changes."
2026-07-08,x,day-12-x-accidental-coding-agent-refactor-native,native_post,posted_accidental,https://x.com/ruchitdalwadi/status/2074881271621198245,,,,,,0,"Unintended native X post detected during twitterapi.io verification at 2026-07-08T15:40:19Z, likely caused by stale composer focus during browser keyboard submit. Logged transparently; no further public posting was attempted after detection."
2026-07-08,campaign,day-12-skip-gate-comment-session,comment_session,over_cap_after_delayed_verification,https://x.com/ruchitdalwadi/with_replies,79849,521,66,,,4,"User explicitly asked to skip the 2.5-hour gate and comment on both X and LinkedIn. LinkedIn was attempted first on Alpesh Sonar's AI agents production article; editor accepted text but submit controls did not land the comment after multiple paths, so it was not counted. Posted 2 verified X replies under timneutkens and tibor_tee. During verification, two delayed replies from the prior timed-out browser call were discovered under HowToPrompt__ and blader, bringing July 8 cold comments to 13/12; stopped all further public actions. No DMs, follows, likes, reposts, profile edits, paid actions, uploads, or account/security changes."
2026-07-09,campaign,day-13-comment-session-1,comment_session,partial_linkedin_only,https://www.linkedin.com/search/results/content/,,,,,,2,"Comment-session gates passed by local state and browser health. Posted 2 browser-verified LinkedIn comments under fresh in-lane search-result posts: Naveen Kumar RAG refusal gate/evals and Ankur Patankar agent memory as data problem. X scout ran at 6/12/20 and selected practical rooms, but two X browser reply attempts timed out and twitterapi.io did not verify any new X reply after two checks, so no X reply was counted. No DMs, follows, likes, reposts, profile edits, paid actions, uploads, or account/security changes."
2026-07-09,campaign,day-13-comment-session-2,comment_session,partial_linkedin_only,https://www.linkedin.com/search/results/content/,,,,,,1,"Comment-session gates passed by local state and browser health. LinkedIn sampled 20+ fallback lanes. One verified LinkedIn comment landed under Akash Kamerkar's Claude Code workflow poll; lower-search-result targets were not counted because precise target verification failed. X scout ran at 6/12/20; the Riley Brown benchmark reply was filled but inline submit timed out, and twitterapi.io did not verify a new X reply, so no X reply was counted. No DMs, follows, likes, reposts, profile edits, paid actions, uploads, or account/security changes."
2026-07-09,campaign,day-13-comment-session-3,comment_session,partial_linkedin_only,https://www.linkedin.com/search/results/content/,,,,,,3,"Comment-session gates passed by local state and browser health. LinkedIn sampled 16+ lanes and posted 3 browser-verified comments under Ronnie Sheer, Steph S., and Igor Ivanov. X scout ran at 6/12/20; one mervenoyann reply was filled and submitted through browser page state, but twitterapi.io did not verify it after one recheck, so no X reply was counted. No DMs, follows, likes, reposts, profile edits, paid actions, uploads, or account/security changes."
2026-07-09,campaign,day-13-comment-session-4,comment_session,partial_linkedin_only,https://www.linkedin.com/search/results/content/,,,,,,4,"Comment-session gates passed by local state and browser health. LinkedIn sampled 18+ fallback lanes and posted 4 browser-verified comments under Purva Tonde, Kavita Baberwal, ARADHANA DUBEY, and M Khadar Basha Jilan. X scout ran at 6/12/20; candidates were skipped for promo, company/news launch, crypto/finance/politics-adjacent, hiring, course/lead-gen, generic listicle, low-fit, or weak practical opening reasons, so no X reply was attempted or counted. No DMs, follows, likes, reposts, profile edits, paid actions, uploads, or account/security changes."
2026-07-09,x,day-13-comment-session-5,comment_session,posted_cap_reached,https://x.com/ruchitdalwadi/with_replies,561998,1076,48,,,2,"Comment-session gates passed: browser tab creation/navigation succeeded, newest verified cold comment was 2026-07-09T15:39:35Z, and July 9 cold-comment count was 10/12 before this session. User requested X comments; daily cap left exactly 2 slots, so session was limited to 2 X replies. X scout ran at 6, 12, and 20; skipped company/product launch promos, AI news/listicles, crypto/finance, course/lead-gen, and weak practical-opening rooms. Posted 2 X replies with visible DOM composer verification and 2+ minute spacing, then verified through twitterapi.io: just_dennie commit-hooks/guardrails reply 2075288889141690863 and danshipper workflow-compression reply 2075289936312549401. July 9 cold-comment cap is now 12/12. No DMs, follows, likes, reposts, profile edits, paid actions, uploads, or account/security changes."
2026-07-10,campaign,day-14-comment-session-1,comment_session,posted,https://x.com/ruchitdalwadi/with_replies,122002,1217,109,,,5,"Comment-session gates passed: browser tab creation/navigation succeeded on retry, newest verified cold comment was 2026-07-09T18:44:12Z, and July 10 cold-comment count was 0/12 before this session. LinkedIn sampled 16 fallback lanes and posted 2 browser-verified comments under Nino Gorgadze and Ashish Singh; skipped polls, hiring, company promos, old/weak rooms, recent duplicate authors, and course/lead-gen posts. X scout ran at 6 and 12; posted 3 X replies with visible DOM composer verification and 2+ minute spacing, then verified through twitterapi.io: Suhail task-mix bakeoff reply 2075440460471099605, kunchenguid failure-shape model-choice reply 2075441091059597680, and mitsuhiko cache-miss visibility reply 2075441723669627251. No DMs, follows, likes, reposts, profile edits, paid actions, uploads, or account/security changes."
2026-07-10,x,day-14-comment-session-2,comment_session,posted_x_only,https://x.com/ruchitdalwadi/with_replies,63055,763,165,,,3,"Comment-session gates passed: browser tab creation/navigation succeeded, newest verified cold comment was 2026-07-10T04:47:21Z, and July 10 cold-comment count was 5/12 before this session. LinkedIn sampled 16 fallback lanes and selected Himanshu Gupta plus Vivek Gupta, but the LinkedIn editor rejected text entry through two browser paths after opening the composer, so LinkedIn was stopped and no LinkedIn row was counted. X scout ran at 6, 12, and 20; posted verified X replies under eliana_jordan model-choice/project-context reply 2075485153787551876, ClaudeCodeLog background-agent upgrade logging reply 2075485816634458424, and ArtificialAnlys benchmark translation-layer reply 2075486650814304409. A Jun Song prompt-context reply remained unverified after one twitterapi.io recheck and was not counted. July 10 cold-comment count is now 8/12. No DMs, follows, likes, reposts, profile edits, paid actions, uploads, or account/security changes."
2026-07-10,x,day-14-comment-session-3,comment_session,posted_cap_reached,https://x.com/ruchitdalwadi/with_replies,101730,828,114,,,4,"Comment-session gates passed: browser tab creation/navigation succeeded, newest verified cold comment was 2026-07-10T07:45:52Z, and July 10 cold-comment count was 8/12 before this session. LinkedIn sampled 5 fallback lanes and selected Tim Moore, but the LinkedIn editor rejected text entry through direct type and clipboard/paste fallback after opening the composer, so LinkedIn was stopped and no LinkedIn row was counted. X scout ran at 6, 12, and 20; skipped crypto, finance, politics, course/lead-gen, promo/company hype, duplicate/prior attempted target, and weak-fit rooms. Posted 4 verified X replies with visible DOM composer verification and 2+ minute spacing, then verified through twitterapi.io: hyojun_at fanout-budget reply 2075529569952800855, hqmank reset-backlog reply 2075530385258434944, sudoingX tmux-agent-infra reply 2075531154342735887, and DeryaTR_ reset-artifact reply 2075531891495813512. July 10 cold-comment cap is now 12/12. No DMs, follows, likes, reposts, profile edits, paid actions, uploads, or account/security changes."
