date,platform,asset,action,status,url,impressions,likes,comments,reposts,clicks,replies,notes
2026-06-20,linkedin,anchor-post,publish,posted,https://www.linkedin.com/feed/update/urn:li:activity:7474074950476382208/,244,2,1,0,,,Published via local browser; first comment edited to LinkedIn UTM link; 244 visible impressions at 2026-06-22T15:25:17+05:30; first comment showed 28 impressions; profile viewers stayed 28; 2026-06-22T17:27:32+05:30 refresh attempt could not complete after browser tab crash/policy block
2026-06-20,linkedin,document-carousel,publish-attempt,blocked_file_upload,,,,,,,"Caption prefilled; LinkedIn did not expose a browser-accessible PDF upload input, so carousel was not published",
2026-06-20,x,thread,publish,posted,https://x.com/ruchitdalwadi/status/2068304482589650946,106,2,2,1,,2,Root tweet at 106 visible views as of 2026-06-22T15:25:17+05:30; link reply posted at https://x.com/ruchitdalwadi/status/2068304756179931420; Luke Sophinos remains the only verified response; Luke reply view count showed 27 in notifications; 2026-06-22T17:27:32+05:30 refresh attempt timed out then browser policy blocked retry
2026-06-20,linkedin,pre-launch-comments,comment,pending,,,,,,,5 comments before anchor post,
2026-06-20,x,post-launch-replies,reply_batch,posted,,,,,,,Batch A posted: https://x.com/ruchitdalwadi/status/2068375965752021269 https://x.com/ruchitdalwadi/status/2068376145280839822 https://x.com/ruchitdalwadi/status/2068376187139948849 https://x.com/ruchitdalwadi/status/2068376227967304132 https://x.com/ruchitdalwadi/status/2068376269579055580,
2026-06-20,x,post-launch-replies-batch-b,reply_batch,posted,,,,,,,Batch B posted under live GTM/AI-agent conversations: https://x.com/ruchitdalwadi/status/2068379658677256638 https://x.com/ruchitdalwadi/status/2068379782845550763,
2026-06-20,x,post-launch-replies-batch-c,reply_batch,posted,,,,,,,Batch C posted under live AI-agent GTM/founder-led-sales conversations: https://x.com/ruchitdalwadi/status/2068380961314914786 https://x.com/ruchitdalwadi/status/2068380996974895157,
2026-06-20,x,standalone-1,draft,ready,,,,,,,Post day +1,
2026-06-20,x,paid-pilot-followup,draft,ready,,,,,,,Prepared in copy-ready/x-paid-pilot-followup.txt; publish only if engagement batches stay quiet at the next meaningful checkpoint,
2026-06-21,x,horizontal-gpt-followup,draft,ready,,,,,,,Prepared in copy-ready/x-horizontal-gpt-followup.txt from Luke Sophinos's horizontal GPT objection; publish only after explicit approval,
2026-06-21,x,horizontal-gpt-link-reply,draft,ready,,,,,,,Prepared in copy-ready/x-horizontal-gpt-link-reply.txt; add only after explicit approval and preferably after native post engagement,
2026-06-21,x,horizontal-gpt-engagement-queue,draft,ready,,,,,,,Prepared in horizontal-gpt-engagement-queue-2026-06-21.md from live X searches; post only after explicit approval and live target recheck,
2026-06-20,x,standalone-2,draft,ready,,,,,,,Post day +2,
2026-06-20,x,standalone-3,draft,ready,,,,,,,Post day +3 to +7,
2026-06-20,linkedin,standalone-2,draft,ready,,,,,,,Use only if anchor post slows,
2026-06-21,linkedin,horizontal-gpt-followup,draft,ready,,,,,,,Prepared in copy-ready/linkedin-horizontal-gpt-followup.txt from Luke Sophinos's horizontal GPT objection; publish only after explicit approval,
2026-06-21,linkedin,horizontal-gpt-first-comment,draft,ready,,,,,,,Prepared in copy-ready/linkedin-horizontal-gpt-first-comment.txt; add only after explicit approval and after the LinkedIn follow-up is live,
2026-06-21,linkedin,horizontal-gpt-engagement-queue,draft,ready,,,,,,,Prepared in linkedin-horizontal-gpt-engagement-queue-2026-06-21.md from live LinkedIn searches; post only after explicit approval and live target recheck,
2026-06-21,campaign,next-approval-bundle,draft,ready,,,,,,,Prepared in next-approval-bundle.md; recommends approving Luke reply first,
2026-06-21,campaign,luke-reply-runbook,draft,ready,,,,,,,Prepared in luke-reply-execution-runbook.md; exact execution and logging steps for approved Luke reply,
2026-06-22,campaign,high-engagement-commenting-playbook,draft,ready,,,,,,,Prepared in high-engagement-commenting-playbook.md; shifts primary rescue lever to comments/replies inside already-active LinkedIn and X posts,
2026-06-22,campaign,high-engagement-scout-queue,draft,ready,,,,,,,Prepared in high-engagement-scout-queue-2026-06-22.md; ranked target map for LinkedIn/X high-engagement scouting before any approved comment batch,
2026-06-22,linkedin,high-engagement-comment-batch,draft,ready,,,,,,,Prepared in linkedin-high-engagement-comment-batch-2026-06-22.md; post only after explicit approval and live target recheck,
2026-06-22,x,high-engagement-reply-batch,draft,ready,,,,,,,Prepared in x-high-engagement-reply-batch-2026-06-22.md; post only after explicit approval and live target recheck,
2026-06-20,newsletter,blurb,draft,ready,,,,,,,Send only if newsletter tool/list exists,
2026-06-20,direct,outreach-batch-1,public_touches,partial_sent,,,,,,,,8/10 public touches completed; Forum skipped after review; Michael/AI Seed pending after browser reset
2026-06-20,direct,outreach-batch-2,draft,ready,,,,,,,10 high-relevance people,
2026-06-20,direct,outreach-batch-3,draft,ready,,,,,,,10 high-relevance people,
2026-06-22,linkedin,high-engagement-comment-keerthan-singhvi,comment,posted,https://www.linkedin.com/feed/update/urn:li:activity:7469961485763379200/,,,,,,,No-link comment posted under AI retention-agent/GTM workflow post; visible pre-post counters 67 reactions and 14 comments; comment counter increased to 15
2026-06-22,linkedin,high-engagement-comment-apuarv-sethi,comment,posted,https://www.linkedin.com/search/results/content/?keywords=AI%20agents%20GTM&origin=GLOBAL_SEARCH_HEADER,,,,,,,"No-link comment posted under AI-first marketing/GTM agent workflow post; visible pre-post counters 226 reactions, 13 comments, 7 reposts; comment text verified in DOM"
2026-06-22,linkedin,high-engagement-comment-manas-yash-sunita-pal,comment,posted,https://www.linkedin.com/search/results/content/?keywords=paid%20pilot%20startup&origin=GLOBAL_SEARCH_HEADER,,,,,,,"No-link comment posted under paid-pilot/design-partner post; visible pre-post counters 54 reactions, 6 comments, 7 reposts; comment counter increased to 7"
2026-06-22,linkedin,high-engagement-comment-bluepen-ai,comment,posted,https://www.linkedin.com/search/results/content/?keywords=paid%20pilot%20startup&origin=GLOBAL_SEARCH_HEADER,,,,,,,No-link comment posted under first-paid-pilot/full-price-user-pull post; visible pre-post counters 16 reactions and 2 comments; comment text verified in DOM
2026-06-22,linkedin,high-engagement-comment-alen-alosious,comment,posted,https://www.linkedin.com/in/alenalosious/,,,,,,,No-link comment posted under GTM systems/positioning/customer-acquisition post; visible post counters after posting 10 reactions and 8 comments; landed on first visible AI positioning GTM result rather than intended Dipti article
2026-06-22,campaign,daily-activity-ledger,draft,ready,,,,,,,"Prepared daily-activity-ledger.csv to compare planned vs actual X posts, LinkedIn posts, reply batches, comment batches, direct outreach, metric checks, and verified replies",
2026-06-22,campaign,today-execution-pack,draft,ready,,,,,,,"Prepared today-execution-pack-2026-06-22.md; recommends Luke reply first, X high-engagement reply batch second, horizontal GPT follow-up only after signal, and stricter LinkedIn scouting before another comment batch",
2026-06-22,campaign,pace-audit,draft,ready,,,,,,,Prepared pace-audit-2026-06-22.md; current measured owned-post impressions 293 against 100k goal; recommends Luke reply then X high-engagement reply batch,
2026-06-22,campaign,heartbeat-automation,update,updated,,,,,,,Updated heartbeat automation at 2026-06-22T19:27:29+05:30 from 2-hour passive checks to 6-hour action-oriented checks; no live platform action taken; last verified reach remains 350,
2026-06-23,x,luke-sophinos-horizontal-gpt-reply,reply,posted,https://x.com/ruchitdalwadi/status/2069334400366780856,,,,,,,Posted no-link reply under Luke Sophinos's horizontal GPT objection; target URL https://x.com/lukesophinos/status/2068384975523643431; Luke reply showed 30 views before posting
2026-06-23,x,high-engagement-reply-daryl-ai-agents-gtm,reply,posted,https://x.com/ruchitdalwadi/status/2069334741413961784,20,0,0,0,,0,"Posted no-link reply under daryl/B3 GTM Lead AI agents post; target had 13 replies, 10 reposts, 60 likes, 46 bookmarks, 4085 views at 2026-06-23T15:08:18+05:30; reply showed 20 views"
2026-06-23,x,high-engagement-reply-dan-rosenthal-ai-native-output,reply,posted,https://x.com/ruchitdalwadi/status/2069334868153233471,3,0,0,0,,0,"Posted no-link reply under Dan Rosenthal AI-native team-output post; target had 2 replies, 8 reposts, 14 likes, 12 bookmarks, 509 views at 2026-06-23T15:08:18+05:30; reply showed 3 views"
2026-06-23,campaign,ai-teaching-pivot,plan,ready,,,,,,,"Prepared ai-teaching-pivot-2026-06-23.md; main lane now practical AI teaching across agents, models, prompts, systems, frameworks, tools, updates, jokes, and memes",
2026-06-23,x,ai-teaching-prompt-to-system-native-post,post,posted,https://x.com/ruchitdalwadi/status/2069335656711717063,16,0,0,0,,0,Published first AI-teaching native X post: prompt collection vs AI systems; profile recovery showed 16 views at 2026-06-23T15:08:18+05:30
2026-06-23,x,ai-teaching-reply-peter-yang-dynamic-workflow,reply,posted,https://x.com/ruchitdalwadi/status/2069337083051982917,13,0,0,0,,0,"Posted no-link teaching reply under Peter Yang's Claude Code dynamic workflow question; target had 26 replies, 7 reposts, 61 likes, 61 bookmarks, 10176 views at 2026-06-23T15:08:18+05:30; reply showed 13 views"
2026-06-23,x,ai-coding-reply-matthew-berman-pr-queue,reply,posted,https://x.com/ruchitdalwadi/status/2069337442050793939,5,0,1,0,,1,"Posted no-link AI-coding workflow reply under Matthew Berman's PR queue post; target had 72 replies, 117 likes, 23 bookmarks, 24274 views at 2026-06-23T15:08:18+05:30; reply showed 5 views and 1 visible reply count"
2026-06-23,linkedin,ai-teaching-prompt-to-system-native-post,post,blocked_editor_focus,https://www.linkedin.com/feed/,,,,,,,"Attempted to publish LinkedIn native AI-teaching post, but the composer editor accepted focus without accepting typed/pasted text; closed composer with no post sent"
2026-06-23,campaign,heartbeat-automation,update,updated,,,,,,,"Updated heartbeat automation prompt at 2026-06-23T14:05:06+05:30 to reflect AI-teaching pivot and autonomous public posting/commenting; DMs, emails, uploads, profile edits, paid actions, and account/security changes remain excluded",
2026-06-23,x,ai-teaching-reply-madni-claude-code-specialists,reply,posted,https://x.com/ruchitdalwadi/status/2069354242792665280,,0,0,0,,0,"Posted no-link teaching reply under Madni Aghadi's Claude Code specialists article; target had 8 replies, 27 reposts, 180 likes, 333 bookmarks, 203356 views at URL recovery"
2026-06-23,linkedin,ai-teaching-comment-claire-vo-codebase-prompt,comment,posted,https://www.linkedin.com/search/results/content/?keywords=Claude%20Code%20AI%20agents&origin=GLOBAL_SEARCH_HEADER,,0,0,0,,0,"Posted no-link teaching comment under Claire Vo's Claude Code/codebase leverage post; visible post counters moved from 44 reactions, 3 comments, 2 reposts to 44 reactions, 4 comments, 2 reposts; comment text: codebase is part of the prompt, clear interfaces/tests/docs/ownership are agent affordances, messy repos accelerate confusion"
2026-06-27,linkedin,ai-teaching-comment-parul-stepfun-agent-eval,comment,posted,https://www.linkedin.com/search/results/content/?keywords=Claude%20Code%20AI%20agents&origin=GLOBAL_SEARCH_HEADER,,0,0,0,,0,"Posted no-link AI-teaching comment under Parul Gautam's StepFun/Claude Code agent-builder post; visible post counters moved from 251 reactions and 62 comments to 251 reactions and 63 comments; comment visible from Ruchit D You; angle: rank agent-tool choices by context/retrieval fit, permissions/rollback, eval harness/acceptance tests, then token cost"
2026-06-27,x,ai-teaching-tool-choice-workflow-native-post,post,posted,https://x.com/ruchitdalwadi/status/2070839733262197234,0,0,0,0,,0,Published first day-1 sprint X native post on AI tool comparisons starting with workflow before cost; X alert showed post sent and home timeline showed the post from Ruchit Dalwadi
2026-06-27,linkedin,ai-teaching-tool-choice-native-post,post,blocked_editor_input,https://www.linkedin.com/feed/,,0,0,0,33,0,"Attempted LinkedIn native post on AI tool choice/workflow ranking; feed sidebar showed profile viewers 33 and post impressions 161; composer opened but both Playwright typing and direct DOM typing failed to insert text, so no LinkedIn native post was sent"
2026-06-27,linkedin,ai-teaching-tool-choice-native-post-retry,post,blocked_editor_input,https://www.linkedin.com/feed/,,0,0,0,33,0,"Retried LinkedIn native post after user request; composer opened visually and showed empty editor plus disabled Post button; clipboard paste, alternate paste shortcut, and direct coordinate typing all failed to insert text; Escape closed the empty composer; no LinkedIn native post was sent"
2026-06-27,linkedin,ai-teaching-comment-ashwini-ai-architect-evals,comment,posted,https://www.linkedin.com/search/results/content/?keywords=AI%20agents%20workflow%20evals&origin=GLOBAL_SEARCH_HEADER,,0,0,0,,0,"Posted no-link AI-teaching comment under Ashwini K's AI Architect/RAG/multi-agent/eval-framework post; visible counters moved from 20 reactions, 5 comments, 3 reposts to 20 reactions, 6 comments, 3 reposts; comment visible from Ruchit D You; angle: trusted eval metrics separate production agents from demos"
2026-06-27,x,ai-teaching-reply-peter-yang-claude-code-interruptibility,reply,posted,https://x.com/ruchitdalwadi/status/2070841116631666722,0,0,0,0,,0,"Posted no-link reply under Peter Yang's Claude Code UX wishlist; target showed 27 replies, 4 reposts, 101 likes, 21 bookmarks, 12994 views before posting and moved to 28 replies after; reply angle: interruptibility beats blind autonomy"
2026-06-27,linkedin,ai-teaching-comment-om-mishra-claude-workflow-comparison,comment,posted,https://www.linkedin.com/search/results/content/?keywords=Claude%20Code%20agent%20workflow&origin=GLOBAL_SEARCH_HEADER,,0,0,0,,0,"Posted no-link comment under Om Mishra's Claude Code workflow comparison post; target showed 432 reactions, 45 comments, 25 reposts before posting and moved to 46 comments after; visible comment from Ruchit D You; room quality included Addy Osmani comment with 100 reactions"
2026-06-27,x,ai-teaching-reply-claire-vo-agent-prototype-harness,reply,posted,https://x.com/ruchitdalwadi/status/2070844040858456373,0,0,0,0,,0,"Posted no-link reply under Claire Vo's Codex + Claude Code agent prototype post; target showed 4 replies, 6 reposts, 189 likes, 443 bookmarks, 26666 views; reply angle: agent prototypes need a harness loop with task/tools/eval/failure case/handoff"
2026-06-27,x,ai-teaching-reply-cyril-claude-workflows,reply,draft_discarded,https://x.com/cyrilXBT/status/2070316244826198254,,0,0,0,,0,"Attempted second additional X reply under CyrilXBT Claude workflows post; target had 13 replies, 44 reposts, 224 likes, 502 bookmarks, 179237 views, but composer editing appended multiple drafts and exceeded character limit; discarded unsent draft; no public reply posted"
2026-06-27,campaign,heartbeat-2026-06-27-2159,maintenance_check,blocked_browser_control,https://x.com/notifications,,0,0,0,,0,"Heartbeat maintenance check attempted at 2026-06-27T21:59:40+05:30. Local campaign state inspected first. X notifications navigation timed out and reset browser control; reconnect attempt also timed out. No public posts, replies, comments, DMs, emails, uploads, profile edits, paid actions, or security changes were made."
2026-06-28,x,ai-teaching-inbound-reply-radhesh-workflow-learning,reply,posted,https://x.com/ruchitdalwadi/status/2070945783042724080,0,0,0,0,,0,Replied to older substantive inbound from Radhesh Kanumury under ASPR AI/Suvan thread. Draft length 182 chars. X alert showed post sent and reply URL recovered.
2026-06-28,linkedin,ai-teaching-comment-aakash-ai-workflows-acceptance-tests,comment,posted,https://www.linkedin.com/feed/,0,0,0,0,,0,"Posted no-link LinkedIn comment under Aakash Gupta AI workflow/skills/ontology post. Visible target counters before commenting: 340 reactions, 26 comments, 10 reposts. Comment text emphasized workflow acceptance tests, examples, failure cases, and review owner; page verified comment text appeared after submit."
2026-06-28,x,ai-teaching-reply-claudedevs-dynamic-workflows,reply,posted,https://x.com/ruchitdalwadi/status/2070946752325456299,0,0,0,0,,0,"Posted no-link X reply under ClaudeDevs dynamic workflows post; target showed 371 replies, 1.3K reposts, 10K likes, 6.2K bookmarks, 4.1M views. Draft length 202 chars."
2026-06-28,x,ai-teaching-reply-rahul-claude-code-shortcuts,reply,posted,https://x.com/ruchitdalwadi/status/2070946824475832417,0,0,0,0,,0,"Posted no-link X reply under Rahul Claude Code shortcuts post; target showed 24 replies, 79 reposts, 303 likes, 545 bookmarks, 56.7K views. Draft length 203 chars."
2026-06-28,x,ai-teaching-reply-langchain-lyft-agent-evals,reply,posted,https://x.com/ruchitdalwadi/status/2070947088977002952,0,0,0,0,,0,"Posted no-link X reply under LangChain/Lyft AI agents evals post; target showed 8 replies, 9 reposts, 38 likes, 32 bookmarks, 5958 views. Draft length 187 chars."
2026-06-28,x,ai-teaching-reply-avi-ai-roadmap-evals-earlier,reply,posted,https://x.com/ruchitdalwadi/status/2070947143549132900,0,0,0,0,,0,Posted no-link X reply under Avi Chawla full-stack AI engineering roadmap post. Draft length 202 chars; angle: put testing and evals earlier so outputs become checkable.
2026-06-28,x,ai-teaching-reply-nav-projects-need-evals,reply,posted,https://x.com/ruchitdalwadi/status/2070947214990721511,0,0,0,0,,0,"Posted no-link X reply under Nav Toor AI engineer projects post; target showed 58 replies, 476 reposts, 2.6K likes, 220K views in search. Draft length 204 chars."
2026-06-28,x,ai-teaching-reply-aditya-validation-loops,reply,posted,https://x.com/ruchitdalwadi/status/2070947282149900739,0,0,0,0,,0,"Posted no-link X reply under aditya AI agents/evals resource post; target showed 61 replies, 737 reposts, 4.2K likes, 370K views in search. Draft length 202 chars."
2026-06-28,x,ai-teaching-reply-thariq-dynamic-harness,reply,skipped_ambiguous_composer,https://x.com/trq212/status/2061907337154367865,,0,0,0,,0,Skipped X reply under Thariq dynamic harness post after main article exposed two reply buttons due nested/quoted content; no public reply posted to avoid wrong target.
2026-06-28,x,ai-teaching-reply-cyril-workflows-kill-switch-retry,reply,skipped_ambiguous_composer,https://x.com/cyrilXBT/status/2070316244826198254,,0,0,0,,0,Skipped retry under Cyril workflows post after main article exposed two reply buttons due nested/quoted content; no public reply posted.
2026-06-28,linkedin,ai-teaching-comment-aakash-ai-native-pm-screen-share,comment,posted,https://www.linkedin.com/search/results/all/?keywords=Claude%20Code%20agents&origin=GLOBAL_SEARCH_HEADER,0,0,0,0,,0,"Posted no-link LinkedIn comment under Aakash Gupta AI-native PM/screen-share post. Target showed 239 reactions, 46 comments, 8 reposts before commenting; comment text: screen share reveals the loop, not vocabulary; watch task framing, context pull, verification, and recovery."
2026-06-28,linkedin,ai-teaching-reply-aakash-thread-builder-pm,reply,posted,https://www.linkedin.com/search/results/all/?keywords=Claude%20Code%20agents&origin=GLOBAL_SEARCH_HEADER,0,0,0,0,,0,"Posted LinkedIn thread reply inside Aakash AI-native PM discussion. Reply angle: future PM is one path with two muscles; strategy without building loses contact with reality, building without judgment ships faster noise."
2026-06-28,linkedin,ai-teaching-comment-jayaprakash-trustworthy-agent-cost,comment,posted,https://www.linkedin.com/pulse/cheapest-ai-agent-one-you-can-trust-jayaprakash-v-yk7lc/,0,0,0,0,,0,"Posted no-link LinkedIn article comment under Jayaprakash V's Cheapest AI Agent article. Target showed 21 reactions, 12 comments, 1 repost before commenting; editor cleared and comment text remained visible. Angle: measure agent ROI per verified outcome, including review, rollback, exception handling, and revalidation."
2026-06-28,linkedin,ai-teaching-comment-vasu-system-level-evals,comment,posted,https://www.linkedin.com/pulse/from-ai-agents-digital-workers-why-e2e-orchestration-demands-sharma-5xu5c/,0,0,0,0,,0,"Posted no-link LinkedIn article comment under Vasu Sharma's system-level evals article. Angle: multi-agent systems need integration tests for handoffs, state, tool permissions, and final business outcome; editor cleared and comment text remained visible."
2026-06-28,linkedin,ai-teaching-comment-shubham-agentic-eval-metrics,comment,posted,https://www.linkedin.com/pulse/evals-simplified-agentic-eval-metrics-plain-english-shubham-thakur-gbkqc/,0,0,0,0,,0,"Posted no-link LinkedIn article comment under Shubham Thakur's agentic eval metrics article. Angle: separate journey and destination evals; scope, tool use, recovery from bad intermediate state, and real-world final check."
2026-06-28,linkedin,ai-teaching-comment-vaibhav-agent-constraints,comment,draft_not_posted,https://www.linkedin.com/search/results/all/?keywords=Claude%20Code%20agents&origin=GLOBAL_SEARCH_HEADER,,0,0,0,,0,"Attempted LinkedIn comment under Vaibhav Sisinty's Ponytail/AI coding agents post; editor accepted draft but submit did not clear the editor, so this was not counted as posted. Left unsent rather than risk duplicate or wrong-target posting."
2026-06-28,campaign,heartbeat-2026-06-28-0200,maintenance_check,blocked_browser_control,https://x.com/notifications,,0,0,0,,0,"Heartbeat maintenance check attempted at 2026-06-28T02:00:42+05:30. Local state inspected first; today already has one X reply batch and one LinkedIn comment batch. X notifications navigation timed out and reset browser control; reconnect attempt also timed out. No public posts, replies, comments, DMs, emails, uploads, profile edits, paid actions, or security changes were made. Next highest-leverage action once browser recovers: publish first Day-2 X native post on prompts-to-systems."
2026-06-28,x,ai-teaching-prompts-to-systems-native-post,post,submit_outcome_unknown,https://x.com/compose/post,,0,0,0,,0,"Heartbeat action attempted at 2026-06-28T06:10:00+05:30. Draft was verified at 251 chars and direct X compose opened, but the compose submit path timed out and follow-up URL verification also timed out. Do not count as posted until the prompts-to-systems text is visible on the profile or a status URL is recovered."
2026-06-28,x,ai-teaching-prompts-to-systems-native-post-retry,post,posted,https://x.com/ruchitdalwadi/status/2071090027891957859,0,0,0,0,,0,"Heartbeat retry at 2026-06-28T10:07:00+05:30. Verified prior unknown attempt was not visible on profile, reopened X compose, filled 261-char prompts-to-systems native post, clicked enabled Post button, and verified phrase visible on profile with status URL recovered."
2026-06-28,campaign,heartbeat-2026-06-28-1007-notifications,maintenance_check,checked,https://x.com/notifications,0,0,0,0,,0,"Bounded X notifications check after native post verification showed Lisa follow, Byron like, Mario repost, Luke like, and Emm follow; no substantive campaign reply requiring response."
2026-06-28,campaign,heartbeat-2026-06-28-1007-linkedin-notifications,maintenance_check,checked,https://www.linkedin.com/notifications/?filter=all,0,0,0,0,,0,Bounded LinkedIn notifications check loaded notifications page and found mostly page/job suggestions such as Inception Studio and Aakash Gupta page suggestions; no clear campaign-quality inbound reply requiring response.
2026-06-28,campaign,heartbeat-2026-06-28-1411-x-notifications,maintenance_check,checked,https://x.com/notifications,0,0,0,0,,0,"Bounded X notifications check showed Lisa follow, Byron Bai like, Mario Meir-Huber repost, Luke Sophinos like, Emm follow, and older Radhesh reply already handled; no new substantive inbound required a response."
2026-06-28,campaign,heartbeat-2026-06-28-1411-linkedin-notifications,maintenance_check,checked,https://www.linkedin.com/notifications/?filter=all,0,0,0,0,,0,"Bounded LinkedIn notifications check showed mostly suggested pages/jobs including Inception Studio, Aakash Gupta, and Lyzr AI suggestions; no campaign-quality inbound reply required a response."
2026-06-28,linkedin,ai-teaching-comment-batch-2-attempt,comment_batch,blocked_editor_input,https://www.linkedin.com/pulse/context-engineering-vs-harness-next-evolution-ai-systems-imdad-areeph-h4c2f/,,0,0,0,,0,"Attempted second LinkedIn comment batch after clean inbound checks. Search surfaced Claude Code workflow and context-vs-harness targets. Skipped already-touched Om Mishra result and keyword-DM bait. On Imdad Areeph context-vs-harness article, LinkedIn editor was visible but blocked input across Playwright click/fill, visible placeholder click, DOM click/type, clipboard paste, and specific aria editor selector; no comment was posted and no draft was counted."
2026-06-28,x,ai-teaching-workflow-spec-native-post,post,posted,https://x.com/ruchitdalwadi/status/2071151914168021339,0,0,0,0,,0,"Posted second Day-2 native X post after LinkedIn editor blocked batch. Initial X Playwright button click timed out and profile verification showed no post; retried through DOM-control Post button and verified phrase visible on profile with status URL recovered. Topic: teams need a tiny workflow spec, not more prompt templates."
