date,platform,asset,action,status,url,impressions,likes,comments,reposts,clicks,replies,notes
2026-06-29,linkedin,ai-teaching-comment-prashanth-private-evals-harness,comment,posted,https://www.linkedin.com/search/results/content/?keywords=AI%20harness%20eval%20workflow&origin=GLOBAL_SEARCH_HEADER,0,0,0,0,,0,"Posted and verified LinkedIn no-link comment under Prashanth Subramanian's private evals and harness architecture article. Target was exact-fit but low visible counters: 1 reaction and 1 comment. Angle: private evals compound because they encode actual workflow; useful harness includes examples, traces, failure cases, review rules, and replayable regressions."
2026-06-29,linkedin,ai-teaching-comment-batch-3,comment_batch,posted,https://www.linkedin.com/search/results/content/?keywords=AI%20harness%20eval%20workflow&origin=GLOBAL_SEARCH_HEADER,0,0,0,0,,0,"Completed third Day-3 LinkedIn comment batch by combining the 2 verified 18:00 fallback comments with 3 verified user-approved after-cutoff continuation comments. Final batch targets: AI-for-work productivity workflow, applied AI forward-deployed workflow, Deepu Prakash human-in-loop article, Mayur Upadhyay human-in-loop coding agents video, and Prashanth Subramanian private evals/harness article."
2026-06-30,linkedin,inbound-check-10-ist,maintenance_check,checked,https://www.linkedin.com/notifications/?filter=all,0,0,0,0,,0,"10:00 IST inbound check: visible LinkedIn notifications were jobs, search appearance, suggested pages, and an old DM preview. No substantive public inbound required response; DM was not opened or answered."
2026-06-30,x,inbound-check-10-ist,maintenance_check,checked,https://x.com/notifications,0,0,0,0,,0,"10:00 IST inbound check: visible X notifications were likes, follows, and older already-handled replies. No new substantive public reply required response."
2026-06-30,linkedin,anish-loop-engineering,comment,posted,https://www.linkedin.com/search/results/content/?keywords=prompt%20engineering%20workflow&origin=GLOBAL_SEARCH_HEADER,0,0,0,0,,0,"Posted and verified LinkedIn no-link comment under Anish Agarwal's loop engineering article. Target showed 42 reactions, 6 comments, and 1 repost. Angle: define trigger, context, allowed action, review rule, and escalation path."
2026-06-30,linkedin,harsh-claude-beginner-workflow,comment,posted,https://www.linkedin.com/search/results/content/?keywords=Claude%20Code%20AI%20workflow&origin=GLOBAL_SEARCH_HEADER,0,0,0,0,,0,"Posted and verified LinkedIn no-link comment under Harsh Singh's Claude beginner courses post. Target showed 48 reactions, 22 comments, and 3 reposts. Angle: beginners should learn reusable workflows with context, constraints, example output, review checklist, and handoff."
2026-06-30,linkedin,apoorva-linkedin-ai-workflow-boundaries,comment,posted,https://www.linkedin.com/search/results/content/?keywords=AI%20workflow%20ChatGPT&origin=GLOBAL_SEARCH_HEADER,0,0,0,0,,0,"Posted and verified LinkedIn no-link comment under Apoorva Pandey's LinkedIn LLM workflow bridge post. Target showed 58 reactions and 64 comments. Angle: define read/write permissions, context boundaries, approvals, and logs before custom AI workflows become custom risk."
2026-06-30,linkedin,jayakrishnan-n8n-reliability-workflows,comment,posted,https://www.linkedin.com/search/results/content/?keywords=AI%20automation%20workflow%20business&origin=GLOBAL_SEARCH_HEADER,0,0,0,0,,0,"Posted and verified LinkedIn no-link comment under Jayakrishnan G's n8n AI automation hiring post. Target showed 30 reactions, 13 comments, and 3 reposts. Angle: real AI automation work is failure handling, retries, logs, dead-letter paths, idempotency, auth refresh, and human review."
2026-06-30,linkedin,hari-ai-coding-cost-review-loop,comment,posted,https://www.linkedin.com/search/results/content/?keywords=model%20choice%20AI%20tools&origin=GLOBAL_SEARCH_HEADER,0,0,0,0,,0,"Posted and verified LinkedIn no-link comment under Hari Sharma's AI coding cost/model choice post. Target showed 18 reactions, below the ideal band but exact-fit. Angle: token cost is usually a process smell; teams need a context/tool/model-choice review loop before merge."
2026-06-30,linkedin,linkedin-comment-batch-1,comment_batch,posted,https://www.linkedin.com/search/results/content/?keywords=model%20choice%20AI%20tools&origin=GLOBAL_SEARCH_HEADER,0,0,0,0,,0,"Completed first Jun30 LinkedIn comment batch with 5 verified no-link comments. Targets: Anish Agarwal loop engineering, Harsh Singh Claude beginner courses, Apoorva Pandey LinkedIn LLM workflow bridge, Jayakrishnan G n8n AI workflows, and Hari Sharma AI coding cost/model choice."
2026-06-30,x,x-native-workflow-engine-morning-attempt,native_post,blocked_unverified,https://x.com/ruchitdalwadi,0,0,0,0,,0,"Attempted first Jun30 native X post with 246-character workflow-engine draft. Compose accepted fill visually and exposed Post button, but two submit attempts did not verify on the profile. Native DOM typing also failed to insert text. No X native post counted."
2026-06-30,x,dann-cursor-ios-inspectable-workflow,reply,posted,https://x.com/ruchitdalwadi/status/2071818732171854162,0,0,0,0,,0,"Posted and verified X reply under Dann Petty's Cursor iOS post. Target showed 257 likes, 10 replies, and 24K views. Angle: mobile agents matter if context, diff, tradeoffs, and handoff stay inspectable."
2026-06-30,x,derya-ai-agents-inline-loop,reply,posted,https://x.com/ruchitdalwadi/status/2071820037791580543,0,0,0,0,,0,"Posted and verified X reply under Derya Unutmaz's AI agents post. Target showed 240 likes, 12 replies, and 24.9K views. Angle: agents need explicit context, allowed tools, done criteria, and human review."
2026-06-30,x,tom-claude-code-minimal-agent-loop-inline,reply,posted,https://x.com/ruchitdalwadi/status/2071820369871470937,0,0,0,0,,0,"Posted and verified X reply under Tom Doerr's reverse-engineered Claude Code architecture post. Target showed 45 likes, 3 replies, and 5.9K views. Angle: useful agents start with a minimal observe/action/check/failure/review loop before frameworks."
2026-06-30,x,claire-gusto-ai-first-smaller-loop-inline,reply,posted,https://x.com/ruchitdalwadi/status/2071820512561594703,0,0,0,0,,0,"Posted and verified X reply under Claire Vo's Gusto AI-first app build post. Target showed 101 likes, 5 replies, and 11K views. Angle: fewer handoffs can matter more than better prompts because AI works when context, decision, build, review, and correction are close."
2026-06-30,x,shubham-one-person-agent-company-review-loop,reply,posted,https://x.com/ruchitdalwadi/status/2071820919958602165,0,0,0,0,,0,"Posted and verified X reply under Shubham Saboo's one-person AI agent company post. Target showed 288 likes, 20 replies, and 31K views. Angle: the underrated part is the review loop and each agent's context, decision logs, failure notes, and human-readable handoff."
2026-06-30,x,omar-qwen-rl-coding-agents-verification,reply,posted,https://x.com/ruchitdalwadi/status/2071821064230015229,0,0,0,0,,0,"Posted and verified X reply under Elvis/Omar's Qwen RL coding agents verification post. Target showed 68 likes, 11 replies, and 6K views. Angle: verification is the moat for coding agents because evals must catch reward hacking, overfitting, and plausible bad patches."
2026-06-30,x,x-reply-batch-1,reply_batch,posted,https://x.com/ruchitdalwadi/with_replies,0,0,0,0,,0,"Completed first Jun30 X reply batch with 6 verified replies: Dann Petty Cursor iOS, Derya AI agents, Tom Doerr Claude Code loop, Claire Vo Gusto AI-first app, Shubham Saboo one-person AI agents, and Elvis/Omar Qwen RL coding agents. All replies were drafted under 240 characters. Unverified modal attempts on Claire/Derya/Tom were not counted; reliable path was inline composer."
2026-06-30,x,inbound-check-14-ist,maintenance_check,checked,https://x.com/notifications,0,0,0,0,,0,"14:00 IST inbound check: X showed two new follows, the blue checkmark/verification notification, and older likes/follows. No substantive public inbound required response."
2026-06-30,linkedin,inbound-check-14-ist,maintenance_check,checked,https://www.linkedin.com/notifications/?filter=all,0,0,0,0,,0,14:00 IST inbound check: LinkedIn showed jobs/search appearance/suggestions and the old DM preview. No substantive public inbound required response; DM was not opened or answered.
2026-06-30,x,x-reply-batch-2-premium-attempt,reply_batch,blocked_unverified,https://x.com/ruchitdalwadi/with_replies,0,0,0,0,,0,"Attempted Premium-aware X reply batch 2 across six medium-hot/exact-fit rooms: Alex Nguyen Cursor doomscrolling, Roundtable agent loops/evals, David Fowler shared PR workflow, CyrilXBT Anthropic finance workflows, Vipin Claude skills, and Dimas AI agent customer discovery. All drafts were under 240 characters. X accepted text on some targets but Reply stayed disabled or did not verify; intent URL fell back to Home. No X replies counted."
2026-06-30,linkedin,ferhat-three-hands-review-boundary,comment,posted,https://www.linkedin.com/search/results/content/?keywords=AI%20for%20work%20operators&origin=GLOBAL_SEARCH_HEADER,0,0,0,0,,0,"Posted and verified LinkedIn no-link comment under Ferhat Balaban's Three Hands on the Work post. Target showed 8 reactions and 3 comments, exact-fit human+AI workflow. Angle: one system generates, one checks, and a human owns final judgment."
2026-06-30,linkedin,prashanth-medical-ai-coding-traceability,comment,posted,https://www.linkedin.com/search/results/content/?keywords=Claude%20Code%20workflow&origin=GLOBAL_SEARCH_HEADER,0,0,0,0,,0,"Posted and verified LinkedIn no-link comment under Prashanth Balasubramanian's AI-native medical-device workflow post. Target showed 12 reactions and 1 repost. Angle: generating code gets cheaper but accepting code requires traceability: requirement, generated change, test evidence, risk note, and owner."
2026-06-30,linkedin,parul-product-ai-decision-memory,comment,posted,https://www.linkedin.com/search/results/content/?keywords=context%20engineering%20AI%20workflow&origin=GLOBAL_SEARCH_HEADER,0,0,0,0,,0,"Posted and verified LinkedIn no-link comment under Parul Mahendru's AI value for product teams article. Target showed 24 reactions and 1 comment before posting. Angle: AI value for product teams is better decision memory: user context, options, tradeoffs, and review notes."
2026-06-30,linkedin,srikanth-enterprise-context-reviewable-ai,comment,posted,https://www.linkedin.com/search/results/content/?keywords=context%20engineering%20AI%20workflow&origin=GLOBAL_SEARCH_HEADER,0,0,0,0,,0,"Posted and verified LinkedIn no-link comment under Srikanth Velamakanni's enterprise context and ontology post. Target showed 179 reactions, 5 comments, and 15 reposts. Angle: context engineering needs enough shared ontology to retrieve facts, expose assumptions, and make outputs reviewable."
2026-06-30,linkedin,manthan-agentic-operations-review-routing,comment,posted,https://www.linkedin.com/search/results/content/?keywords=AI%20agents%20workflow%20operators&origin=GLOBAL_SEARCH_HEADER,0,0,0,0,,0,"Posted and verified LinkedIn no-link comment under Manthan Thakkar's agentic operations post. Target showed 13 reactions, exact-fit operators/workflows. Angle: agentic operations depends on automated-vs-review decisions, exception routing, and evidence shown before trusting outcomes."
2026-06-30,linkedin,linkedin-comment-batch-2,comment_batch,posted,https://www.linkedin.com/search/results/content/?keywords=AI%20agents%20workflow%20operators&origin=GLOBAL_SEARCH_HEADER,0,0,0,0,,0,"Completed second Jun30 LinkedIn comment batch with 5 verified comments: Ferhat Balaban, Prashanth Balasubramanian, Parul Mahendru, Srikanth Velamakanni, and Manthan Thakkar. One stale-node Srikanth attempt was retried and verified; stale attempt was not counted."
2026-06-30,campaign,premium-aware-heartbeat-update,maintenance_check,checked,local-automation,0,0,0,0,,0,"Updated recurring heartbeat automation with X Premium-aware strategy: 2-3 native X posts/day, 3 X reply batches, optional 3-reply Premium mini-batch when stable, no X profile edits during checkmark review, verified-only counting, and current 10/14/18/22 IST operating windows."
2026-06-30,x,inbound-check-18-ist,maintenance_check,checked,https://x.com/notifications,0,0,0,0,,0,"18:00 IST inbound check: X notifications showed follows, blue-check verification notice, older likes/follows, and no substantive public reply requiring response."
2026-06-30,linkedin,inbound-check-18-ist,maintenance_check,checked,https://www.linkedin.com/notifications/?filter=all,0,0,0,0,,0,18:00 IST inbound check: LinkedIn notifications showed jobs/search/suggestions plus old DM preview only. No substantive public inbound; DM was not opened.
2026-06-30,x,x-native-15-minute-ai-exercise-evening-attempt,native_post,blocked_editor_input,https://x.com/compose/post,0,0,0,0,,0,"Attempted 18:00 IST native X post using new voice-and-value rules. Draft was 254 chars: a 15-minute AI exercise for teams. X composer opened and showed a visible post box, but Playwright click timed out; DOM typing did not retain text and page bounced back to /home. No X native post counted."
2026-06-30,x,peter-yang-open-source-reviewability-reply-attempt,reply,blocked_unverified,https://x.com/petergyang/status/2071730786886435261,0,0,0,0,,0,"Attempted X reply under Peter Yang restricted access/open-source AI post. Target showed 7.6K views, 25 likes, 6 replies, and 3 bookmarks. Inline composer accepted 226-char reply about open weights plus workflow traces/reviewability, but after submit the reply did not verify on with_replies or target conversation. Not counted."
2026-06-30,linkedin,aman-ai-team-interfaces-comment-attempt,comment,blocked_editor_input,https://www.linkedin.com/search/results/content/?keywords=AI%20for%20work%20teams%20workflow&origin=GLOBAL_SEARCH_HEADER,0,0,0,0,,0,"Attempted LinkedIn comment under Aman Kumar's multi-agent AI team / Friday launch post. Target showed 59 reactions and 39 comments. Draft gave concrete implementation rule: owner agent per step, handoff artifact, evidence, and stop condition. LinkedIn editor opened but rejected DOM typing, clipboard paste, coordinate typing, and Playwright fill. No comment posted or counted."
2026-06-30,x,x-native-15-minute-ai-exercise-evening-retry,native_post,manual_packet_needed,https://x.com/compose/post,0,0,0,0,,0,"Retried queued X native post at 20:30 IST from a fresh X tab. Composer was visible, but DOM typing still did not retain text. Marked retry queue row manual_packet_needed; no post counted."
2026-06-30,x,peter-yang-open-source-reviewability-reply-retry,reply,manual_packet_needed,https://x.com/petergyang/status/2071730786886435261,8917,26,6,0,,0,"Retried queued Peter Yang X reply at 20:35 IST. Target still active at 8,917 views, 26 likes, 6 replies, 3 bookmarks. Inline composer accepted text and Reply was clicked, but reply did not verify on with_replies. Marked manual_packet_needed."
2026-06-30,linkedin,aman-ai-team-interfaces-comment-retry,comment,manual_packet_needed,https://www.linkedin.com/search/results/content/?keywords=AI%20for%20work%20teams%20workflow&origin=GLOBAL_SEARCH_HEADER,0,74,51,0,,0,Retried queued LinkedIn comment under Aman Kumar multi-agent AI team post at 20:40 IST. Target was still active at 74 reactions and 51 comments. Editor opened but rejected typed text from fresh state. Marked manual_packet_needed.
2026-06-30,x,peter-yang-ai-adoption-one-workflow-reply,reply,posted,https://x.com/ruchitdalwadi/status/2071977732133769691,0,0,0,0,,0,"Posted and verified late-block X reply under Peter Yang's AI adoption / Jess Yan post. Target showed 3,583 views, 7 replies, 4 reposts, 16 likes, and 7 bookmarks before posting. Draft length 238 chars. Angle: adoption path is one person, one recurring workflow, one review rule; AI becomes leverage when messy input becomes reviewed output without a 20-team process."
2026-06-30,x,late-block-x-reply-batch-3-browser-control,reply_batch,blocked_browser_timeout,https://x.com/search?q=%22AI%20adoption%22%20workflow&src=typed_query&f=live,0,0,0,0,,0,"21:35 IST late-block recovery attempted after retry queue was exhausted. Browser reconnected, but tab listing timed out and reset the kernel before any X target could be inspected or replied to. No public action posted or counted."
2026-06-30,x,overnight-x-recovery-search-claude-code-workflow,reply_batch,blocked_browser_timeout,https://x.com/search?q=(%22Claude%20Code%22%20OR%20Cursor)%20(workflow%20OR%20agent%20OR%20agents)&src=typed_query&f=live,0,0,0,0,,0,"23:21 IST overnight recovery attempted because Day 4 was materially behind. Current AI adoption search was mostly low-quality launch spam, so switched once to a stronger Claude Code/Cursor workflow lane. Navigation timed out and reset browser control before target inspection. No public action posted or counted."
2026-06-30,x,x-premium-pain-lane-hayyan-specialists-reply,reply,posted,https://x.com/ruchitdalwadi/status/2072022320127033522,1199,38,19,22,,0,"Pain-based X Premium lane: using AI / AI at work / ChatGPT workflow bottlenecks. Replied under Hayyan specialist workflow post. Target after posting showed 1,199 views, 19 replies, 22 reposts, 38 likes, 13 bookmarks. Angle: specialists should own failure modes, not just prompts; drafter, skeptic, operator, reviewer roles."
2026-06-30,x,x-premium-pain-lane-charlota-ai-design-process-reply,reply,posted,https://x.com/ruchitdalwadi/status/2072022507419582771,2025,29,4,0,,0,"Pain-based X Premium lane. Replied under Charlota AI-in-design-process post. Target showed 2,025 views, 4 replies, 29 likes, 12 bookmarks before/around posting. Angle: clients buy a sharper review loop, faster exploration, cleaner options, and explainable direction choices, not the AI tool itself."
2026-06-30,x,x-premium-pain-lane-sarah-bloome-multi-agent-reply,reply,posted,https://x.com/ruchitdalwadi/status/2072022646343217558,6804,71,0,1,,0,"Pain-based X Premium lane. Replied under Sarah Parker/Bloome multi-agent workflow post. Target showed 6,804 views, 71 likes, 1 repost, 1 bookmark. Angle: multi-agent value is role separation and handoff rule: draft, attack weak points, fill gaps, human final cut."
2026-06-30,x,x-premium-pain-lane-datacamp-ai-proficiency-reply,reply,posted,https://x.com/ruchitdalwadi/status/2072022819756818699,4339,27,4,2,,0,"Pain-based X Premium lane. Replied under DataCamp beginner AI proficiency post. Target after posting showed 4,339 views, 4 replies, 2 reposts, 27 likes, 40 bookmarks. Angle: beginner AI proficiency should be tested by recurring-task workflow, context boundary, allowed changes, and output review."
2026-07-01,x,day-5-1000-ist-x-notifications-browser-control,inbound_check,blocked_browser_timeout,https://x.com/notifications,0,0,0,0,,0,10:00 IST Day 5 active block attempted X notifications first. Navigation timed out and reset browser control; one reconnect attempt also timed out. No inbound was inspected and no public action was posted or counted.
2026-07-01,x,day-5-1000-ist-home-feed-x-reply-batch,reply_batch,verification_unknown,https://x.com/home,0,0,0,0,,0,"Started Day 5 10:00 IST X reply batch from responsive home feed after notification URL failed. Prepared four under-240-char replies for Chris Raroque connectors, Pawel Huryn Sonnet/model choice, Claire Vo Claude access/workflows, and Peter Yang Fable usage limits. Batch runner timed out after submit flow began; recovery verification on with_replies also timed out. No replies counted until verified; four rows added to retry-queue.csv as verify_before_retry."
2026-07-01,x,day-5-1130-ist-due-x-retry-verification,retry-verification,blocked_browser_timeout,https://x.com/ruchitdalwadi/with_replies,,,,,,,Four due verify_before_retry X rows were due at 11:03 IST. Verification via with_replies timed out twice from fresh browser-control sessions before public state could be read. No replies were reposted or counted; rows preserved to avoid duplicates.
2026-07-01,campaign,day-5-1215-ist-browser-control-health-check,retry-verification,blocked_browser_timeout,,,,,,,,12:14 IST heartbeat found four due X verify_before_retry rows. Browser control timed out while reading the selected tab before any live X or LinkedIn page could be inspected. No public action posted or counted; due rows preserved.
2026-07-01,campaign,day-5-1300-ist-browser-control-health-check,browser_health_check,blocked_browser_timeout,,,,,,,,"12:59 IST heartbeat: browser setup connected, but minimal selected-tab health check timed out and reset control. No X or LinkedIn page could be inspected; no public action posted or counted. Four X verify_before_retry rows preserved."
2026-07-01,campaign,day-5-1344-ist-browser-tab-listing-health-check,browser_health_check,blocked_browser_timeout,,,,,,,,"13:44 IST heartbeat: browser setup connected, but both tab listing/user open-tabs health check timed out before any live X or LinkedIn page could be reached. No public action posted or counted. Four X verify_before_retry rows preserved."
2026-07-01,campaign,day-5-1429-ist-browser-troubleshooting-gate,browser_health_check,blocked_browser_timeout,,,,,,,,"14:29 IST heartbeat: read browser troubleshooting guidance, reacquired fresh browser, and tried fresh tab creation. Fresh tab creation timed out. No X or LinkedIn action posted or counted. Updated heartbeat automation with a browser-health gate to avoid repeated failed live-platform loops until browser is responsive."
2026-07-01,campaign,day-5-2300-ist-user-gap-recovery,browser_health_check,blocked_browser_timeout,,,,,,,,"23:00 IST user requested today status and gap recovery on both X and LinkedIn. Campaign audit showed Day 5 at zero verified public actions and four X verify_before_retry rows preserved. Browser bootstrap succeeded, but LinkedIn navigation timed out/reset; reconnect succeeded, then selected-tab inspection timed out/reset. No public post, reply, comment, DM, email, upload, profile edit, paid action, or security change was made."
2026-07-02,x,day-5-chris-raroque-ai-assistant-connectors-reply,reply_retry,posted,https://x.com/ruchitdalwadi/status/2072179626743587195,,,,,,,Verified on with_replies during 00:27 IST retry pass. This reply had landed earlier despite prior browser verification failure. Target: https://x.com/raroque/status/2072076576376725800
2026-07-02,x,day-5-pawel-huryn-sonnet-model-choice-reply,reply_retry,posted,https://x.com/ruchitdalwadi/status/2072393460985073786,,,,,,,"Posted during clean retry and verified on with_replies. Target showed ~7,000 views, 18 replies, 41 likes, 9 bookmarks before retry. Target: https://x.com/PawelHuryn/status/2072023054272602449"
2026-07-02,x,day-5-claire-vo-claude-access-workflows-reply,reply_retry,posted,https://x.com/ruchitdalwadi/status/2072393573857968245,,,,,,,"Posted during clean retry and verified on with_replies/in-thread. Target showed ~6,389 views, 7 replies, 50 likes, 4 bookmarks before retry. Target: https://x.com/clairevo/status/2072114916623048856"
2026-07-02,x,day-5-peter-yang-fable-usage-limits-reply,reply_retry,posted,https://x.com/ruchitdalwadi/status/2072393680334541257,,,,,,,"Posted during clean retry and verified on with_replies/in-thread. Target showed ~123.1K views, 97 replies, 611 likes, 67 bookmarks before retry. Target: https://x.com/petergyang/status/2072165346476511583"
2026-07-02,linkedin,day-6-0118-ist-linkedin-first-comment-batch,comment_batch,blocked_browser_timeout,https://www.linkedin.com/search/results/content/?keywords=AI%20workflow,,,,,,,"01:18 IST heartbeat attempted LinkedIn-first comment batch after X retry queue cleared. Browser connection succeeded, but LinkedIn search navigation timed out/reset; recovery selected-tab inspection also timed out/reset. No LinkedIn comment posted or counted."
2026-07-02,linkedin,day-6-rishita-confident-wrongness-verification-comment,comment,posted,https://www.linkedin.com/groups/12505570/?q=highlightedFeedForGroups&highlightedUpdateUrn=urn%3Ali%3Aactivity%3A7478320080150384640,,2,,,,0,"Verified in-page on LinkedIn search results. Comment angle: verification has to be designed before production AI output; source context, changed action, evidence, and human stop owner are the practical test."
2026-07-02,linkedin,day-6-harish-ai-tools-workflow-compression-comment,comment,posted,https://www.linkedin.com/search/results/content/?keywords=AI%20workflow&origin=GLOBAL_SEARCH_HEADER,,717,137,88,,0,"Verified in-page on Harish kumar's 3h AI tools/workflows post. Target showed 717 reactions, 137 comments, and 88 reposts after posting. Comment angle: workflow compression matters more than tool replacement; repeatable loop with human checkpoint."
2026-07-02,linkedin,day-6-brevity-ai-save-10-hours-workflow-comment,comment,posted,https://www.linkedin.com/search/results/content/?keywords=AI%20workflow&origin=GLOBAL_SEARCH_HEADER,,3,1,1,,0,"Verified in-page on Brevity Software Solutions AI 10-hours-saved poll. Target showed 3 reactions, 1 comment, and 1 repost. Comment angle: use saved time for customer conversations after removing one recurring internal bottleneck with human checkpoint."
2026-07-02,linkedin,day-6-sgs-ai-at-work-workflow-automation-comment,comment,posted,https://www.linkedin.com/search/results/content/?keywords=AI%20workflow&origin=GLOBAL_SEARCH_HEADER,,2,4,1,,0,"Verified in-page on SGS Consulting AI-at-work poll. Target showed 2 reactions, 4 comments, and 1 repost. Comment angle: workflow automation needs approval path, named owner, exception rule, and change log."
